id,text,label,Comments
27,ribileſqꝫ hereſes inter chriſtianos ſeminauit. Ut ⁊ per ſe¬,ribilesque haereses inter christianos seminavit. Ut et per se-,
2666,ciem cultus exterioris; ⁊ ad hanc diem,ciem cultus exterioris; et ad hanc diem,
3448,qͦs vnꝰ erat ſimilimꝰ ſct̄o nicolao. qͥ ſic ait illis heu,quos unus erat simillimus sancto nicolao. qui sic ait illis heu,
3408,ip̄e ſic̄ filius qͥ naͣliter ē hͦ qd̓ eſt pr̄ Cor dei pr̄is archa¬,ipse sicut filius qui naturaliter est hoc quod est pater Cor dei praesentis arca-,
157,potamij. Drapes. Phares. Argi¬,potamii. Drapes. Phares. Argi-,
1725,ꝑ quā on̄dit. ꝙ oē peccatū mortale eſt irre,per quam ostendit. quod omne peccatum mortale est irre,
49,regina Macedonie. dedignatus ei,regina Macedoniae. dedignatus ei,
88,ꝙ cū venit Philippus ex p̄lio eijciet,quod cum venit Philippus ex proelio eiciet,
210,inde humanā formam accipiens. et,inde humanam formam accipiens. et,
1409,illectꝰ miẜrime ab vniu̓ſis hijs corruit bo¬,illectus miserrime ab universis iis corruit bo-,
3033,det̉ intellexiſſe ⁊cͣ. Et vide pleniꝰ d̓ iſtis,detur intellexisse et cetera. Et vide plenius de istis,
2094,rem. v Ipſum aīm. ę.,rem. u Ipsum animum. ae.,
2595,tus inſtitute. Tamē rectius hoc dicitur,tus institutae. Tamen rectius hoc dicitur,
3284,vite: qꝛ licet p̄ſcita ⁊ p̄deſtinata ſit ad,vitae: quia licet praescita et praedestinata sit ad,
300,multis curis irruētibus in abolitiōe reli¬,multis curis irruentibus in abolitione reli-,
3107,ceſſaſſēt aque ſuꝑ faciē terre. Que cū nō inue,cessassent aquae super faciem terrae. Quae cum non inve,
2537,guſtinus pͥmo de trinitate. Nec pe,gustinus primo de trinitate. Nec pe,
1736,mala docuit otioſitas. Illas vero ſcri,mala docuit otiositas. Illas vero scri,
2671,et per q̄ꝫ vera ſūt. q̄ vera ſūt oīa. Deus ſapientia in qͦ,et per quem vera sunt. quae vera sunt omnia. Deus sapientia in quo,
2984,bet̉ ꝙ nemo debet ignorare ſciētiā in qua,betur quod nemo debet ignorare scientiam in qua,
1298,Res aūt quibꝰ vtendum eſt. mūdus eſt,Res autem quibus utendum est. mundus est,
3143,dixit ad eos. Creſcite et ml̓tiplica,dixit ad eos. Crescite et multiplica,
1547,eſt inſtitutus. ff. de vul. ⁊ pu. vbi vide ⁊ per Fred. de ſe. cōſi. ix.,est institutus. ff. de vul. et pu. ubi vide et per Fred. de se. consi. ix.,
1342,geli illo fruentes iam beati ſunt. quo et,geli illo fruentes iam beati sunt. quo et,
3654,pra moduꝫ grauati ſumus. ita vt tedet nos etiaꝫ viuere.,pra modum gravati sumus. ita ut taedet nos etiam vivere.,
3146,lia terre et ſuper omnes volucres celi cum vni,lia terrae et super omnes volucres caeli cum uni,
1497,to. Oldr. in conſi. xiiij. incipiente cum queritur an beneficium,to. Oldr. in consi. xiiij. incipiente cum quaeritur an beneficium,
3208,tiſfactione ſuorū reatuū diſponere vt ſacrifitium,tisfactione suorum reatuum disponere ut sacrificium,
3334,forte peccaueris non deſperes. ſꝫ curras illico,forte peccaveris non desperes. sed curras ilico,
524,cto impetu ⁊ euaginato gladio tru¬,cto impetu et evaginato gladio tru-,
24,um nomē: illiuſqꝫ ſanctā crucē imperator romanus alijqꝫ,um nomen: illiusque sanctam crucem imperator romanus aliique,
3194,minus diſcrete poſtolauit. Secūdo vidēduꝫ quid,minus discrete postulavit. Secundo videndum quid,
1534,¶ Abbatis conſenſus nō requiritur in iudicio qn̄ monachuſ,¶ Abbatis consensus non requiritur in iudicio quando monachus,
2084,quuntur vniuerſi: & eſt,quuntur universi: et est,
1320,fruitur vtitur. Aſſumit em̄ aliquid in fa,fruitur utitur. Assumit enim aliquid in fa,
321,Ei omnipotētis aſpira,Ei omnipotentis aspira,
91,sed anteqͣꝫ multa tempora elabunt̉.,sed antequam multa tempora elabuntur.,
2240,nullomō ꝯſenciētes ab inicio uſqꝫ in finē pcc̄ꝫ mor¬,nullo modo consentientes ab initio usque in finem peccatum mor-,
3366,frequētius lectioni mēſe ītereſſet: audiuit ībidē qualit̓,frequentius lectioni mensae interesset: audivit ibidem qualiter,
1724,Ad primam rationē,Ad primam rationem,
2457,ficij miſſe,ficii missae,
1341,Idem in li. de doctrina xp̄iana ait. An¬,Idem in li. de doctrina christiana ait. An-,
1504,¶ Abbas etiam priuatus tenet primum locum inter mona¬,¶ Abbas etiam privatus tenet primum locum inter mona-,
2048,DA. Dauus ſū nō ędipꝰ. SI. nēpe ergo aperte,DA. Davus sum non oedipus. SI. nempe ergo aperte,
2285,a iiij,a iiii,
1638,ſtatū ſue ꝯditiōis iudicat de re nō in tꝑe:,statum suae conditionis iudicat de re non in tempore:,
3139,diebꝰ. terre ſemētꝭ. et meſſis. frigꝰ et eſtꝰ. e¬,diebus. terrae sementis. et messis. frigus et aestus. e-,
222,ſuſqꝫ cubiculum aſcendit in lectum,susque cubiculum ascendit in lectum,
1779,ſicut in libro miſſali ꝯtinet̉. In qͦ gloria in excelſis. Alleluia,sicut in libro missali continetur. In quo gloria in excelsis. Alleluia,
1490,capituli niſi contrarium probetur. c. ea noſcitur de his que fi. a,capituli nisi contrarium probetur. c. ea noscitur de his quae fi. a,
2491,menias ſicut voci exteriꝰ ꝓlate im¬,menias sicut voci exterius prolate im-,
2480,Omē,Nomen,
19,fidei ꝓrumpebāt. Et cū precioſiſſimo ſanguine dn̄i noſtri,fidei prorumpebant. Et cum preciosissimo sanguine domini nostri,
531,de exercitu dixit alexādro.,de exercitu dixit alexandro.,
3620,dum qn̄cūqꝫ non eſt alia neceſſitas Nā in neceſſi,dum quandocumque non est alia necessitas Nam in necessi,
1279,tes ad beatitudinē. adiuuamur ⁊ quaſi,tes ad beatitudinem. adiuvamur et quasi,
3252,cipio ꝟſus īſinuat. q̄ domꝰ interp̄tari,cipio versus insinuat. quae domus interpretari,
2945,clerici. ⁊ ſunt morales id eſt ſcolaſtici ſiue ph̓i. et ſunt religioſi ſi,clerici. et sunt morales id est scholastici sive philosophi. et sunt religiosi si,
2070,viſum eſt.,visum est.,
1688,hō nō. Et tale peccatū irremediabile ē.,homo non. Et tale peccatum irremediabile est.,
1852,Que verba non abſurde ſumi poſſunt ad propoſitū no,Quae verba non absurde sumi possunt ad propositum no,
3257,captiuitatē in babilonē reducit̉: ⁊ iō,captivitatem in babylonem reducitur: et ideo,
3114,in ore ſuo. Intellexit gͦ noe: ꝙ ceſſaſſēt aque,in ore suo. Intellexit ergo noe: quod cessassent aquae,
172,tenenſqꝫ in manu virgam palme. ⁊,tenensque in manu virgam palmae. et,
2621,lis. ¶ Quantū obligamur ⁊ quotiens/,lis. ¶ Quantum obligamur et quotiens/,
2719,Secundo tangunt̉ qͥnqꝫ q̄ pn̄t eſſe rep̄henſibilia circa ac¬,Secundo tanguntur quinque quae possunt esse reprehensibilia circa ac-,
413,lio meo comminantur. Taliter eo,lio meo comminantur. Taliter eo,
3010,currere. Et primo.,currere. Et primo.,
1608,dūmō habeāt̉ neceſſaria ad celebratōꝫ reqͥſita. ¶ Dubi tertiū. Quid ſi in,dummodo habeantur necessaria ad celebrationem requisita. ¶ Dubium tertium. Quid si in,
1514,cruces ⁊ alia neceſſaria eccleſie ⁊ cultui diuino niſi ex priuilegio,cruces et alia necessaria ecclesiae et cultui divino nisi ex privilegio,
511,inde Olimpiā trahens vt ſecū duce,inde Olympiam trahens ut secum duce,
1511,nio ferendo in cauſa ſi aduocatus neſciuit cām defendere. bar.,nio ferendo in causa si advocatus nescivit causam defendere. bar.,
2645,fieri de per accidens pro manifeſta vtili¬,fieri de per accidens pro manifesta utili-,
2192,diei feſti pr̄iarcha ꝑ ſingl̓os ānos ad dictā ecc̄iaꝫ,diei festi patriarcha per singulos annos ad dictam ecclesiam,
2673,vita. in qͦ ⁊ a qͦ ⁊ ꝑ q̄ꝫ viuūt. q̄ vere ſūmeqꝫ viuūt oīa,vita. in quo et a quo et per quem vivunt. quae vere summeque vivunt omnia,
3280,iuxta allegoriā xp̄i eccl̓ia .ſ. illa celeſtꝭ,iuxta allegoriam christi ecclesia scilicet illa caelestis,
2913,docium. Si quis nocturno pollutus,dotium. Si quis nocturno pollutus,
3065,maximꝰ orator apud grecos demoſthe¬,maximus orator apud graecos demosthe-,
2100,tumelia. poteſt em̄ ſenē,tumelia. potest enim senem,
2353,gelio dicat. Eſtote miſericordes ſic̄ pater vr̄,gelio dicat. Estote misericordes sicut pater vester,
407,ciuuatis dixit anectanabuſ. Fili ale,ciuvatis dixit anectanabus. Fili ale,
1628,ti ſuꝑ qͦlibꝫ altari ꝯſecrato celebrare. Sol. Nō ſꝑ lꝫ. nā poſtqͣꝫ ep̄s aliqͥs ſu,ti super qualibet altari consecrato celebrare. Solutio. Non semper licet. nam postquam episcopus aliquis su,
1257,heym: in ſuo quē de ſcriptoribus Eccleſiaſticis edidit,heym: in suo quem de scriptoribus Ecclesiasticis edidit,
3009,miret̉. qꝛ nec omnium memoria potuit oc,miretur. quia nec omnium memoria potuit oc,
2442,ſint ⁊ alie miſſe diuiſiōes: ſed iſta planior eſt. De qͦ Lec. 15.,sint et aliae missae divisiones: sed ista planior est. De quo Lec. 15.,
1508,¶ Abbas imꝑitus non debet priuarj ſi alias ſit diſcretus ⁊ ꝑi,¶ Abbas imperitus non debet privari si alias sit discretus et peri,
1326,tum qui in re gaudent. nō iam in ſpe et,tum qui in re gaudent. non iam in spe et,
2099,nō ędipus: Multiplex cō,non oedipus: Multiplex con,
2405,ſticia hac ⁊ iudicio qd̓ ꝯtra me exeqͦr. ⁊ qd̓ de,stitia hac et iudicio quod contra me exequor. et quod de,
2553,celeſtis in ſecula ſeculoꝝ Amē,caelestis in saecula saeculorum Amen,
1862,licet oratōnes facte fuerint et aliqua cerimonialia ſer,licet orationes factae fuerint et aliqua ceremonialia ser,
3419,per Hieremiā dicit. ꝙ filius ſemꝑ generat̉,per Hieremiam dicit. quod filius semper generatur,
2591,¶ Omnes primi motus qͥ apti ſunt in,¶ Omnes primi motus qui apti sunt in,
1774,tio Et te in cōceptione beate Marie ⁊c̄.,tio Et te in conceptione beatae Mariae et cetera.,
1554,¶ Abbas poteſt accuſari per monachum ſine ipſius licen¬,¶ Abbas potest accusari per monachum sine ipsius licen-,
1714,gētiā dīne mīe ſumit̉ alia rō. et ſunt ī vni¬,gentiam divinae misericordiae sumitur alia ratio. et sunt in uni-,
2390,metip̄m reū mortis et̓ne corā te ꝓnūcio. Et hͨ,met ipsum reum mortis eternae coram te pronuntio. Et haec,
2111,ſe cōfirmet nō ędipum.,se confirmet non oedipum.,
2049,Vis q̄ reſtāt me loqui? DA. ſane ꝗdē. SI. ſi ſenſero,Vis quae restant me loqui? DA. sane quidem. SI. si sensero,
3569,expoſuit in euangelio. Math̓. xij. d. Generatio praua et ad,exposuit in evangelio. Matthe. xii. d. Generatio prava et ad,
1368,¶ Actoris epiſtola,¶ Actoris epistola,
2237,te ⁊ facilitate in quibꝰdam viris ⁊ feminis qd̓ ſolo,te et facilitate in quibusdam viris et feminis quod solo,
463,Quomodo nuncij Darij impe,Quomodo nuntii Darii impe,
1521,li. vj. ⁊ bal. vbi. sͣ. v̓. x. bar. in. l. illud. §. quid ſi actor. ff. quod cu¬,li. vi. et bal. ubi. supra. ver. x. bar. in. l. illud. §. quid si actor. ff. quod cu-,
1710,vl̓ ī fine pꝰ multitudinē electoꝝ iudicio ge,vel in fine post multitudinem electorum iudicio ge,
1758,Et fames non ſapor ꝓuocet appetitū,Et fames non sapor provocet appetitum,
1769,nis beate Marie in feriā ſecundā ꝓximā ſequentē trāſponit̉,nis beatae Mariae in feriam secundam proximam sequentem transponitur,
2718,duntur decem mala q̄ faciūt munera acceptoribus ſuis.,duntur decem mala quae faciunt munera acceptoribus suis.,
1239,ut cupiui cupii cupiuerā: audiui audii audiuerā & audierā. Inueniunt̉,ut cupivi cupii cupiveram: audivi audii audiveram et audieram. Inveniuntur,
1410,nis. Nā qui priꝰ erat deo dilectꝰ factꝰ eſt,nis. Nam qui primus erat deo dilectus factus est,
3081,omniumqꝫ reptiliū q̄ reptāt ſuꝑ terrā. Vniu̓ſi,omniumque reptilium quae reptant super terram. Universi,
3045,. §. auūculus.,. §. avunculus.,
1974,beatiſſimo et feliciſſimo fine potientur. Sed hec quidem. ſermo pro¬,beatissimo et felicissimo fine potientur. Sed haec quidem. sermo pro-,
2402,tur a te diiudicabor/ id ē ꝯdēnabor. ¶ Ampliꝰ,tur a te diiudicabor/ id est condemnabor. ¶ Amplius,
212,Olimpia dixit. Sicut dixiſti magi¬,Olympia dixit. Sicut dixisti magi-,
448,pter aſpectus horribilitatē. siue a si¬,pter aspectus horribilitatem. sive a si-,
1390,ſciētijs ꝑfecti virtutibꝰ et erroribꝰ expurgati: inferiores ſecula,scientiis perfecti virtutibus et erroribus expurgati: inferiores saecula,
2292,ſuetudo valde vniuerſal̓ ī diuerẜ dyoceſibus,suetudo valde universalem in diversis dioecesibus,
2996,tanto citius inueniant̉ ꝑſtringendo: etiā,tanto citius inveniantur perstringendo: etiam,
2920,ſuꝑ hac re cercior Tum ex doctoꝝ ſacrorū lectiōe,super hac re certior Tum ex doctorum sacrorum lectione,
1869,p̄miſſa. Nec inutile michi ꝑſuadere videor aliqͥd de ta,praemissa. Nec inutile mihi persuadere videor aliquid de ta,
2454,ſime oblatōis: que ꝑs incipit ab offertorio: ꝑtes patebūt in ꝓceſſu.,simae oblationis: quae pars incipit ab offertorio: partes patebunt in processu.,
2135,atqꝫ omine. Lege ad homīes: omine ad rem diuinam refert̉.,atque omine. Lege ad homines: omine ad rem divinam refertur.,
1776,cie habetur Ieiuniū quatuor temporum.,ciae habetur Ieiunium quattuor temporum.,
1632,accipit ꝯcl̓onē. et iō hō dr̄ rōalis ſb̓a. ꝗa rō,accipit conclusionem. et ideo homo dicitur rationalis substantia. quia ratio,
2964,de ammonitione omnium ⁊ de morte vt ſint parati erga morteꝫ,de admonitione omnium et de morte ut sint parati erga mortem,
3057,ꝓprie ille qͥ pecora alicuiꝰ a paſcuis ⁊ ar¬,proprie ille qui pecora alicuius a pascuis et ar-,
2960,nitione viroꝝ eccleſiaſticoꝝ ẜm differentias ſtatuum eorundem,nitione virorum ecclesiasticorum secundum differentias statuum eorundem,
1605,cidētia. ¶ Dubi. primū. Quis ſit locꝰ cōis debitꝰ ⁊ ꝯueniēs ad celebrādum,cidentia. ¶ Dubium primum. Quis sit locus communis debitus et conveniens ad celebrandum,
2075,Iam: modo tarditatis ē,Iam: modo tarditatis est,
3347,De impedimento erroris matrimonij.,De impedimento erroris matrimonii.,
1925,da inuaderꝫ vt qͥ mō te viderāt mox e ſūmis oꝑbꝰ ad in¬,da invaderet ut qui modo te viderant mox e summis operibus ad in-,
1365,heſeris atqꝫ ꝑmanſeris. finem in ea po¬,haeseris atque permanseris. finem in ea po-,
1753,maxime qui inbarbes ſunt quātū con,maxime qui inbarbes sunt quantum con,
3228,ro. ſed vni eoꝝ hactenꝰ ſatiſfacere nō,ro. sed uni eorum hactenus satisfacere non,
30,⁊ ſcripturis ſanctiſſimis: ⁊ fortiſſimis diſputationibꝰ: he¬,et scripturis sanctissimis: et fortissimis disputationibus: hae-,
1415,ꝙ erat ab inicio factus eſt ꝓpter nos abſqꝫ,quod erat ab initio factus est propter nos absque,
1855,ī qͥbuſdā monaſteriis. cimiterijs. eccleſiis. ſiue domibꝰ,in quibusdam monasteriis. cimiteriis. ecclesiis. sive domibus,
229,homīe tanqͣꝫ cū deo cōcubuit. Ma,homine tamquam cum deo concubuit. Ma,
3564,Ieſus morietur: ego dixi in ꝑſona jude. Appenderunt mer¬,Iesus morietur: ego dixi in persona iudae. Appenderunt mer-,
2518,magnus vincens ſcientiā noſtram,magnus vincens scientiam nostram,
1485,ij. ⁊ cle. ij. de cele. miſſa.,ii. et cle. ii. de cele. missa.,
1718,bonitati. vt naͣꝫ rōnalē hūanā ex toto ꝑire,bonitati. ut naturam rationalem humanam ex toto perire,
3513,conflixit et moritur Ac ſerpedon male multatus,conflixit et moritur Ac sarpedon male multatus,
2982,cum dixiſſem. ⁊ de here. cuꝫ ex iniuncto.,cum dixissem. et de haere. cum ex iniuncto.,
2197,rit qͥn ſtatī euadat nl̓li deo volēte dubiū fiat De,rit quin statim evadat nostri deo volente dubium fiat De,
2986,anus dicit: Bene eſt pͥuſqꝫ ad ꝟborū īter¬,anus dicit: Bene est priusque ad verborum inter-,
331,mologiā perdit: quia cū prophecia dicta,mologiam perdit: quia cum prophetia dicta,
324,debeo temꝑa ⁊ modos,debeo tempora et modos,
2676,bona ⁊ pulcra ſunt oīa. Deus intelligibilis lux. in qͦ,bona et pulchra sunt omnia. Deus intellegibilis lux. in quo,
3260,eis requies: ſaltim vt ſuis cōſolaren¬,eis requies: saltim ut suis consolaren-,
3268,ſtes ⁊ ſuis ſaturarēt̉ opprobrijs. Pa¬,stes et suis saturarentur opprobriis. Pa-,
1919,cato cōſilio ꝯſpirarēt ⁊ ꝑs qͥdem tuū caput inſidijs pete¬,cato consilio conspirarent et pars quidem tuum caput insidiis pete-,
1487,no. in. c. ſopite. in prin. de cenſi. bal. in mar. v̓. xiij. vide. in ſpe. de,no. in. c. sopite. in prin. de censi. bal. in mar. ver. xiii. vide. in spe. de,
2345,cia. ⁊ iuſticie lumē miſcd̓ia. ſic̄ dic̄ Augꝰ. Qua,tia. et iustitiae lumen misericordia. sicut dicit Augus. Qua,
2211,in kathedra corꝑe apl̓i collocato ꝯtinuo ſacri mini,in kathedra corpore apostoli collocato continuo sacri mini,
3357,ſerāte clemēcia modo quodam ineffabili illuſtratur: et,serante clementia modo quodam ineffabili illustratur: et,
1237,ſequi ī præterito ꝑfecto & pluſquāꝑfecto tertiæ & quartæ cōiugatiōis,sequi in praeterito perfecto et plusquamperfecto tertiae et quartae coniugationis,
1378,Guido de mōte Rotherij cū deuota ⁊ hūili,Guido de monte Rotherii cum devota et humili,
2411,qͥd nō illū iuſtū iudicares in ꝑte iſta. qͣꝫto igit̉,quid non illum iustum iudicares in parte ista. quanto igitur,
1966,dicta ſumerat agnoſcens ampliori honore,dicta sumerat agnoscens ampliori honore,
2505,ſtate ⁊ videte qm̄ ſuauis ē dn̄s Iu,state et videte quoniam suavis est dominus Iu,
1350,in eo qd̓ diligit. et ita iam rem aliqua¬,in eo quod diligit. et ita iam rem aliqua-,
1791,cunt̉ qͣꝫuis miſſa ꝯcludit̉ cum Benedicamꝰ dn̄o. Et poſt cō,cuntur quamvis missa concluditur cum Benedicamus domino. Et post con,
3339,na manus aliquis predicit de moribus et inclinationibꝰ,na manus aliquis praedicit de moribus et inclinationibus,
2178,o Neqꝫ huius tu dicas,o Neque huius tu dicas,
2357,ſtrictio d̓ miſcd̓ie ꝟtute ncc̄e ē vt ardeat ac cla,strictio de misericordiae virtute nostrae est ut ardeat ac cla,
134,carum. Dicūt enim de Anectana¬,carum. Dicunt enim de Anectana-,
1993,ueniſſe percepimus quibus flexꝰ eſt xp̄ianorū dogma venerari: p̄¬,venisse percepimus quibus flexus est christianorum dogma venerari: prae-,
2622,ex diuina autoritate querere ſalutē no¬,ex divina autoritate quaerere salutem no-,
1330,rei ꝓpter ſe. qualiter etiam hic multi ad¬,rei propter se. qualiter etiam hic multi ad-,
122,bus dixit. Si locum mihi dederis,bus dixit. Si locum mihi dederis,
1335,tes nos et hic et in futuro frui.,tes nos et hic et in futuro frui.,
3404,q. x. c. j. circa mediū. v̓. nā poſt verbū.,q. x. c. j. circa medium. ver. nam post verbum.,
1902,Samuel qui Saulē primū Iſrahelitaꝝ Regē inunxit. Gen̄. iij.,Samuel qui Saulem primum Israelitam Regem inunxit. Genesi. iii.,
2460,auffert̉. qͣſi in ſe indurat qͦs iuſto iudicio induratos,aufertur. quasi in se indurat quos iusto iudicio induratos,
1991,rabant. propter conſtantinum qui princeps erat in his partibus,rabant. propter constantinum qui princeps erat in his partibus,
2008,gēmmis ornata vt ſꝑ ſimꝰ mēores paſſōis dn̄i nr̄i,gemmis ornata ut semper simus memores passionis domini nostri,
3181,ſit me dn̄s ad te ut ex filijs tuis ꝯſtituam re,sit me dominus ad te ut ex filiis tuis constituam re,
1903,Longior: eſt curſus vitæ labyrinthus: in ipſum,Longior: est cursus vitae labyrinthus: in ipsum,
2958,pauꝑtas/ opulentia ⁊ ſic de alijs. Et hec tres partes ſunt ſpecia,paupertas/ opulentia et sic de aliis. Et haec tres partes sunt specia,
2327,tis ⁊ narratis. ⁊ ordinata ſic atqꝫ,tis et narratis. et ordinata sic atque,
2954,dictorum ſcꝫ principis ad ſubditos ⁊ econuerſo: ⁊ ſic de alijs; et,dictorum scilicet principis ad subditos et e converso: et sic de aliis; et,
1428,os appellas ignoīe et cōfuſionis ydola et n̄,os appellas ignominiae et confusionis idola et non,
3084,erat ſuꝑ terrā. ab hoīe vſqꝫ ad pecꝰ. tam rep¬,erat super terram. ab homine usque ad pecus. tam rep-,
443,padocie adduxit vnum e¬,padociae adduxit unum e-,
3460,tranſtulit. Pānonios ſtipendarijs adiecit. Getaꝝ populos Ba,transtulit. Pannonios stipendariis adiecit. Getarum populos Ba,
2637,directe ⁊ per ſe. ⁊ abſqꝫ cōſenſu libero. qꝛ,directe et per se. et absque consensu libero. quia,
2466,cū fides eꝰ inter proſpicantes md̓i hꝰ et inter qͦꝝdam,cum fides eus inter prospicantes mundi huius et inter quorundam,
383,xandro. Fili velocitatem tuam dili¬,xandro. Fili velocitatem tuam dili-,
3305,ctionis interiꝰ ⁊ affluentiā demōſtret,ctionis interius et affluentiam demonstret,
1315,li. x. de trini. aliter ꝙͣ ſupra acci,li. x. de trini. aliter quam supra acci,
3227,obnoxiū: qͥbꝰ exoluēdo cottidie labo¬,obnoxium: quibus exsolvendo cottidie labo-,
3422,cis. ſaluator gͦ noſter ſplendor eſt claritatꝭ.,cis. salvator ergo noster splendor est claritatis.,
450,bebat vſtū. ſeu ꝙ in fronte eiꝰ q̄dam,bebat ustum. seu quod in fronte eius quaedam,
2674,Deus beatitudo. in qͦ ⁊ a qͦ ⁊ per q̄ꝫ beata ſūt oīa. deꝰ,Deus beatitudo. in quo et a quo et per quem beata sunt omnia. deus,
1268,principibus vt ſequant̉. Nam Alexander ille magnus,principibus ut sequantur. Nam Alexander ille magnus,
339,Prophetia de futuro eſt. Ecce virgo in,Prophetia de futuro est. Ecce virgo in,
2403,qͣlit̓ verꝰ erit ẜmo ille ꝓpheticꝰ. Iudiciū ⁊ iu¬,qualiter verus erit sermo ille propheticus. Iudicium et iu-,
3094,ram: et inminute ſunt aque. ⁊ clauſi ſunt fon¬,ram: et imminutae sunt aquae. et clausi sunt fon-,
1812,Exemplatiua,Exemplativa,
3389,altera uocalis: altera cōſonans: quas ut diximus mutuari ſolemus: quotiēs illorū nominibus utimur. neſcio,altera vocalis: altera consonans: quas ut diximus mutuari solemus: quotiens illorum nominibus utimur. nescio,
1499,¶ Abbas poteſt creare monachos etiam ſine licentia ep̄i nō,¶ Abbas potest creare monachos etiam sine licentia episcopi non,
1400,gatis: duxi humiliter deſtinandum vt lima correctōnis ve¬,gatis: duxi humiliter destinandum ut lima correctionis ve-,
1473,de preſcrip. no. in. c. abbates in fi. de priuile. in. vi. in. c. veniens,de praescrip. no. in. c. abbates in fi. de privile. in. vi. in. c. veniens,
3075,uerūt in ſuꝑficie terre Porro archa ferebatur,verunt in superficie terrae Porro arca ferebatur,
3572,Sꝫ ⁊ ſi fructū ꝓp̓ū vlmꝰ n̄ habꝫ portare tn̄ vi­,Sed etsi fructum proprium ulmus non habet portare tamen vi-,
2453,inde ſubiunguntur que pertinent ad preparatōem materie diuiniſ¬,inde subiunguntur quae pertinent ad praeparationem materiae divinis-,
2948,membrorum eſt connexio ad inuicem multimoda. Ideo. hec col,membrorum est connexio ad invicem multimoda. Ideo. haec col,
2391,oīa īdubitant̓ iuſte facio. ī hͦ gͦ iuſtꝰ ſuꝫ. Qua¬,omnia indubitanter iuste facio. in hoc ergo iustus sum. Qua-,
1722,et ꝗa corruptio angeli fuit corruptio vnius,et quia corruptio angeli fuit corruptio unius,
2702,Deus qͥ nos deducis ad ianuā. Deus qͥ facis vt pul¬,Deus qui nos deducis ad ianuam. Deus qui facis ut pul-,
2432,cedendū eſt ꝯſeq̄nter ad officiū miſſe breuiꝰ ad declarādū. Et qͣꝫuis,cedendum est consequenter ad officium missae brevius ad declarandum. Et quamvis,
200,reſponſa recipientes ſtatim fecerūt,responsa recipientes statim fecerunt,
1255,publicum Alexandreis illa Gualtheri Inſulani Preſu¬,publicum Alexandreis illa Gualtheri Insulani Praesu-,
364,ſens aūt cogitatio abſcondit̉ in latēte cor,sens autem cogitatio absconditur in latente cor,
3567,ribus judicū dicens. Certe morietur: quia ego in figura eius,ribus iudicum dicens. Certe morietur: quia ego in figura eius,
371,nera percipiebat. Cui tamen iſdem pro¬,nera percipiebat. Cui tamen isdem pro-,
120,uocabat anectanabū. eiqꝫ ſomniuꝫ,vocabat anectanabum. eique somnium,
255,fenſorem tuū. Exurgens autē phi¬,fensorem tuum. Exsurgens autem phi-,
1317,aſſumere aliquid in facultatem volunta,assumere aliquid in facultatem volunta,
3511,mus rodius in pugnando vulneratus cadit Cui,mus rhodius in pugnando vulneratus cadit Cui,
2450,in carnem referunt̉. Et hec in decē particulis notant̉: que etiam ad,in carnem referuntur. Et haec in decem particulis notantur: quae etiam ad,
1227,teſte Varrone: & Didymo qui id ei nomen eſſe oſtendunt: ꝓ quo Cæ,teste Varrone: et Didymo qui id ei nomen esse ostendunt: pro quo Cae,
2281,patrie rectoribus eſſent libri de moribus ⁊ vita principum,patriae rectoribus essent libri de moribus et vita principum,
1682,vn̄ defecit a luce ꝟitatꝭ: ꝓpter illā obūbran¬,unde defecit a luce veritatis: propter illam obumbran-,
3638,¶ De tedio vite.,¶ De taedio vitae.,
1727,cut ⁊ īuiſibile .ſ. negatiue. pͥuatiue. ⁊ ꝯtͣrie.,cut et invisibile scilicet negative. privative. et contrarie.,
2733,Secundo ponunt̉ exempla ⁊ verba ſacre ſcripture que va,Secundo ponuntur exempla et verba sacrae scripturae quae va,
1262,ligentia vt pijs lectoribus & ſtudioſis quibuſlibet ſatiſ,ligentia ut piis lectoribus et studiosis quibuslibet satis,
2266,re. Ideo iuſte me non immerito loqui potuiſſe. nūc pre,re. Ideo iuste me non immerito loqui potuisse. nunc prae,
335,venturū eſt: ſed vel ea memorat que trāſ¬,venturum est: sed vel ea memorat quae trans-,
2179,tibi nō prędictum: duę,tibi non praedictum: duae,
1353,frueris quo efficeris beatus. et in quo,frueris quo efficeris beatus. et in quo,
182,pe peluſiū de egypto. Deniqꝫ veni¬,pe pelusium de aegypto. Denique veni-,
1738,uotōeꝫ magis inflāmauerint qͣꝫ q̄ alli,votionem magis inflammaverint quam quae alli,
2910,corrupti ab extra.,corrupti ab extra.,
1480,¶ Abbas non poteſt in eccleſia ſeculari celebrare diuinum,¶ Abbas non potest in ecclesia saeculari celebrare divinum,
2485,mee Uerbū,meae Verbum,
1392,q̄unt niſi fuerint diuīa gr̄a ⁊ doctrina ībuti. Hec gͦ attēdēs et,queunt nisi fuerint divina gratia et doctrina imbuti. Haec ergo attendens et,
