id,text,label,Comments
2133,d Dedam. Dare eſt quod repetas: dedere ē ad perpetuū:,d Dedam. Dare est quod repetas: dedere est ad perpetuum:,
72,tres in ſe circulos cōtinentem. Pri¬,tres in se circulos continentem. Pri-,
1339,ſed nō adeo plene. Vnde in li. x. de tri.,sed non adeo plene. Unde in li. x. de tri.,
3256,tia mira: exigentibꝰ culpis rurſus ad,tia mira: exigentibus culpis rursus ad,
1451,¶ Abbas datū funduꝫ doctori poteſt reuocari defecta igno,¶ Abbas datum fundum doctori potest revocari defecta igno,
2927,ꝯſideracionū quedam erūt acceſſorie. quedam per,considerationum quaedam erunt accessoriae. quaedam per,
161,tes. Cū hec audiſſet Anectanabus,tes. Cum haec audisset Anectanabus,
301,querā: ſed poſt annos octo petētibus fra¬,queram: sed post annos octo petentibus fra-,
460,equitabit. et de alexandro ſedente in,equitabit. et de alexandro sedente in,
2283,que vitanda ſunt. vitare condiſcerent. Ideoqꝫ Demetri¬,quae vitanda sunt. vitare condiscerent. Ideoque Demetri-,
2692,bene dn̄am̄. Deus per q̄ꝫ diſcimꝰ aliena eſſe. q̄ aliqn̄,bene dominamur. Deus per quem discimus aliena esse. quae aliquando,
2287,ꝑ oblatōꝫ ꝯſecrabant̉. deinde ī tres ꝑtes diſtri,per oblationem consecrabantur. deinde in tres partes distri,
2042,Dehīc poſtulo: (ſi ęquū ē) te oro daue: vt redeat iā,Dehinc postulo: (si aequum est) te oro dave: ut redeat iam,
2511,nomē tuū ⁊ memoriale tuū in deſi¬,nomen tuum et memoriale tuum in desi-,
1520,tu. Inno. in. c. pn̄tium in i. col. in glo. in v̓bo abbatem de teſte.,tu. Inno. in. c. praesentium in i. col. in glo. in verbo abbatem de teste.,
154,perſarum cū multitudine hoſtium,persarum cum multitudine hostium,
194,abijt de egypto ꝓpter artarxerſem,abiit de aegypto propter artarxersem,
2410,⁊ hͦ intentiōe pia: nūquid nō iuſte ageret? nū,et hoc intentione pia: numquid non iuste ageret? num,
1746,manꝰ eleuādo. ſi etiā tui ipſiꝰ vocē au¬,manus elevando. si etiam tui ipsius vocem au-,
46,det eam iaculatū eſt cor eius in con,det eam iaculatum est cor eius in con,
1256,lis (vt vult dominus Abbas Spanhemenſis de Tritten,lis (ut vult dominus Abbas Spanhemensis de Tritten,
1505,chos. l. di. accedens.,chos. l. di. accedens.,
2724,deberent homīes ab officio aduocatōis retrahere.,deberent homines ab officio advocationis retrahere.,
2929,puriꝰ loquēdū fuerit. qm̄ morbꝰ talis ē qͥ vix alit̓,purius loquendum fuerit. quoniam morbus talis est qui vix aliter,
1261,ras imprimendam. Acceſſit tandem noſtra in hac re di,ras imprimendam. Accessit tandem nostra in hac re di,
199,ſtris ſubiugando illos vob̓. Et hec,stris subiugando illos vobis. Et haec,
1911,inferiori miraculo dexteritatis eximie atꝫ inſolite graui¬,inferiori miraculo dexteritatis eximiae atque insolitae gravi-,
1319,huc ſpei. ſed iam rei. Ideoqꝫ omnis qui,huc spei. sed iam rei. Ideoque omnis qui,
3132,Edificauit aūt noe altare dn̄o: et tollēs d̓ cūc,Aedificavit autem noe altare domino: et tollens de cunc,
1889,Nam ꝗd longa dies homini: niſi longa dolorū,Nam quid longa dies homini: nisi longa dolorum,
3002,memoriā ⁊ in nll̓o penitus errare: potius,memoriam et in nullo penitus errare: potius,
3481,quanto ꝯuenienciꝰ eaꝝ ſalus ꝓcurari pt̄. ſiue in¬,quanto convenientius earum salus procurari potest. sive in-,
1607,poſſit licite qn̄qꝫ extra eccl̓iam celebrare. ¶ Sol. Pōt de ſnīa ep̄i vel ſuꝑiorꝭ,possit licite quandoque extra ecclesiam celebrare. ¶ Solutio. Potest de sententia episcopi vel superioris,
3557,tra aduocatus exꝑte criſti ait. Certe criſtus nō debet mori,tra advocatus ex parte christi ait. Certe christus non debet mori,
1288,eſt. alias abuti eſt. nō vti. Nam vſus illi,est. alias abuti est. non uti. Nam usus illi,
342,creauit deus celū ⁊ terrā. Gen̄. 1. De illo,creavit deus caelum et terram. Genesi. 1. De illo,
2611,Nam bonū opꝰ de genere ⁊ morale/ etiā,Nam bonum opus de genere et morale/ etiam,
3349,De impedimento cognatōis carnalis.,De impedimento cognationis carnalis.,
3431,mortali ad vnā horā cū ſꝑ debe,mortali ad unam horam cum semper debe,
498,lo hoſtiliter abijt cōtra regem. Au¬,lo hostiliter abiit contra regem. Au-,
165,homo timidus Uirtus enī nō hec,homo timidus Virtus enim non haec,
438,Qualiter quidā prīceps de Ca¬,Qualiter quidam princeps de Ca-,
2914,ſompnio a celebrando miſſā ceſſare,somnio a celebrando missam cessare,
2704,q̄ꝫ ſitimus potū. qͦ hauſto nunquā ſitiamꝰ. Deꝰ qui,quem sitimus potum. quo hausto numquam sitiamus. Deus qui,
2163,Hic,Hic,
2160,ro. Nō eſt ī hac cauſa lo¬,ro. Non est in hac causa lo-,
297,omelias que in beato Eze¬,homelias quae in beato Eze-,
2098,ſcētis: y Dauꝰ ſum,scentis: y Davus sum,
2119,lide: quia qui ſanus eſt,lide: quia qui sanus est,
1680,cauit. Angelus aūt nō hūit ignorātiā ī pec¬,cavit. Angelus autem non habuit ignorantiam in pec-,
2533,verbis inordinate prolatis incurri,verbis inordinate prolatis incurri,
2517,fectioni cōueniunt. Nam ecce deꝰ,fectioni conveniunt. Nam ecce deus,
3173,ris ſobrius. nichil te immatura nocebit etas,ris sobrius. nihil te immatura nocebit aetas,
1275,reſtituere conant̉: ſequuti hoc Ciceronianū. Vnus ho¬,restituere conantur: secuti hoc Ciceronianum. Unus ho-,
1248,matoribus: Theoderico Greſemūdo (pie,matoribus: Theoderico Gresemundo (piae,
1622,per altari. Sol. Nō lꝫ niſi ſuꝑ altari vl̓ fixo ſiue ſtabili. vel portatili ſiue via,per altari. Solutio. Non licet nisi ſuper altari vel fixo sive stabili. vel portatili sive via,
201,ſtatuam regalē ex lapide nigro ī ho,statuam regalem ex lapide nigro in ho,
442,qꝫ temporibꝰ princeps Ca,que temporibus princeps Ca,
2488,ris diuini interiora ſua ꝯcremātis,ris divini interiora sua concremantis,
3415,Et dn̄s in euangelio mathei. xxiij. Qn̄ volui vos ꝯgͤ¬,Et dominus in evangelio mathei. xxiii. Quando volui vos congre-,
3265,eā cōſolabat̉. īmo facti plangunt̉ ini¬,eam consolabatur. immo facti planguntur ini-,
2941,rali ꝑ totum; ⁊ ſicut ait idem eſſe faciendū moraliū. xxx. ſuꝑ il¬,rali per totum; et sicut ait idem esse faciendum moralium. xxx. super il-,
305,ui. Tua itaqꝫ dilectio: has ſibi ad legen¬,vi. Tua itaque dilectio: has sibi ad legen-,
512,ret ⁊ eam haberet. Accidit autem vt,ret et eam haberet. Accidit autem ut,
2308,in altaribꝰ ⁊ legunt̉ ſuꝑ ea qͣtuor paſſiōes. iiij,in altaribus et leguntur super ea quattuor passiones. iiii,
2943,ctioneꝫ graduum/ ſtatuū/ ⁊ officioꝝ diſtingui poteſt hec collatō,ctionem graduum/ statuum/ et officiorum distingui potest haec collatio,
1997,ſent vitam et maximinus galerius qui cum eis imperauerat tenēs,sent vitam et maximinus galerius qui cum eis imperaverat tenens,
2261,didos iſtos canes temerarios latrones/ et effeminatos,didos istos canes temerarios latrones/ et effeminatos,
3391,quæ ſi noſtris litteris ſcribant̉: hoc eſt his quæ loco ipſius z. apponere cōſueuerant: & cū ipſo .i. noſtro ſur¬,quae si nostris litteris scribantur: hoc est his quae loco ipsius z. apponere consueverant: et cum ipso id est nostro sur-,
291,Prefatio beati Gregorij pa¬,Praefatio beati Gregorii pa-,
2663,illud. et ad hanc ſpeciē operationis vel,illud. et ad hanc speciem operationis vel,
3159,Hec qͦꝫ dixit deꝰ ad nos. et ad filios eiꝰ cuꝫ eo,Haec quoque dixit deus ad nos. et ad filios eius cum eo,
233,venter eiꝰ vocauit ad ſe anectana¬,venter eius vocavit ad se anectana-,
21,tes: ac diſcipuli ducē ſuū ⁊ magiſtrū ſequētes īextimabi,tes: ac discipuli ducem suum et magistrum sequentes inextimabi,
2065,n Nunc. h. d. a. m. p. Hoc eſt recte & ſeuere: & inexorabi,n Nunc. h. d. a. m. p. Hoc est recte et severe: et inexorabi,
3476,Veſꝑe ſabbati quid ſit 35 G,Vespere sabbati quid sit 35 G,
2933,dei reuelaciōe ſpirituali ꝙ ſit ſufficienter,dei revelatione spirituali quod sit sufficienter,
2313,vel tibi. quo actore fiebat/ gr̄as nō agendo ꝓ,vel tibi. quo actore fiebat/ gratias non agendo pro,
2118,z Sane quidē. Sane va,z Sane quidem. Sane va,
3502,ta grecia domū redituꝝ eſſe. Nā ſibi in yda ſilua,ta graecia domum rediturum esse. Nam sibi in ida silva,
280,ctum eſt a deo per ſomnium vidi.,ctum est a deo per somnium vidi.,
2194,vnanimit̓ clamātiū ⁊ īdeficiētibꝰ vocibꝰ poſtulan,unanimiter clamantium et indeficientibus vocibus postulan,
3575,tamen ſanctos uiros donis ſpiritualibꝰ plenos,tamen sanctos viros donis spiritualibus plenos,
136,ſus de aſtrologia et mathematica,sus de astrologia et mathematica,
1702,ret hoīem. ꝙ cito peccauit. donec ſpēs hūa,ret hominem. quod cito peccavit. donec species huma,
45,ret pulchritudinē eius. Hic cum vi,ret pulchritudinem eius. Hic cum vi,
445,pulchrū nimis. ligatūqꝫ ex omī par,pulchrum nimis. ligatumque ex omni par,
3574,ecc̄iaꝫ ꝙͣuis ſpūaliū v̓tutū dona nō hēant du,ecclesiam quamvis spiritualium virtutum dona non habeant du,
1734,⁊ pcc̄ꝫ dānatoꝝ. ¶ 3º mō dn̄t̉ irremiſſibilia,et peccatum damnatorum. ¶ tertio modo dicuntur irremissibilia,
2908,Cancellarij ⁊ ꝑijſienẜ de ſcrupulo quorūdā an debe,Cancellarii et parisiensis de scrupulo quorundam an debe,
113,ſuccos illarū tulit. ⁊ fecit incantatio¬,succos illarum tulit. et fecit incantatio-,
2381,miſiſti īpietatē pctī mei. Si igit̉ hͦ potuit apd̓,misisti inpietatem peccati mei. Si igitur hoc potuit apud,
3209,altaris offerretur pn̄taliter pro ſe. Cum hoc cōnīs,altaris offerretur praesentaliter pro se. Cum hoc communis,
3444,nr̄o Ade nobiliſſimo quē dn̄s māibꝰ ſuis formauerat. Gen̄. iij. l. diſ. In capite.,nono Adae nobilissimo quem dominus manibus suis formaverat. Genesi. iii. l. dis. In capite.,
2396,ratio debet̉ ī ꝯſiſtorio tuo. Snīam gͦ abſoluti¬,ratio debetur in consistorio tuo. Sententiam ergo absoluti-,
1788,ſto natiuitatis. In qͣ Gloria in excelſis Sequentia Grates,sto nativitatis. In qua Gloria in excelsis Sequentia Grates,
1417,mortem ſuſtinēs hoſtem iam ſupradictū qͥ,mortem sustinens hostem iam supradictum qui,
198,ſeruitutē ⁊ vlciſcetur de inimicis ve,servitutem et ulciscetur de inimicis ve,
1304,In omnibꝰ rebus ille tantū ſunt quibꝰ,In omnibus rebus illae tantum sunt quibus,
76,thena eburnea ⁊ ex ea ꝓtulit ſeptem,thena eburnea et ex ea protulit septem,
50,dicere domīa. Ad hec reſpondēs ei,dicere domina. Ad haec respondens ei,
3549,ſed exꝑte criſti eſt fidelitas.,sed ex parte christi est fidelitas.,
1659,ſic̄ dii ſciētes bonū ⁊ malū. Sꝫ angelꝰ pecca,sicut dii scientes bonum et malum. Sed angelus pecca,
2476,titus venerabil̓ mgr̄i Henrici,titus venerabilis magistri Henrici,
3528,¶ Queritur que in hoc numero ſeptenario inuente ſunt,¶ Quaeritur quae in hoc numero septenario inventae sunt,
1635,do: tal̓ ē ꝯꝑatio intellectꝰ angelici ad intelle,do: talis est comparatio intellectus angelici ad intelle,
1970,remoueāt hoīes ab huius vite delectacioni¬,removeant homines ab huius vitae delectationi-,
1640,eā totā ſil̓. gͦ certiſſime iudicat. Si gͦ peccat,eam totam ſimul. ergo certissime iudicat. Si ergo peccat,
3542,Iudices ſunt quatuor ꝓphete maiores: ſcꝫ Da¬,Iudices sunt quattuor prophetae maiores: scilicet Da-,
304,ab anguſtijs tribulationū licuit: emenda¬,ab angustiis tribulationum licuit: emenda-,
3251,Que nā ſit q̄ plorat: Beth lr̄a ex pͥn¬,Quaenam sit quae plorat: Beth littera ex prin-,
2581,euitare. et hͦ imputabit̉ ad culpā morta,evitare. et hoc imputabitur ad culpam morta,
3317,vtilis decātacō pſalmi. Incipio eī dice̓ ꝓph̓e,utilis decantatio psalmi. Incipio eius dicere prophetae,
1874,Longa infœlicis thalami conſorcia fine,Longa infelicis thalami consortia fine,
3184,Trāſeat. non enī ꝯplacet deo. venit et ſecūdꝰ,Transeat. non enim complacet deo. venit et secundus,
3127,rā. educ tecū: et egrediemini ſuꝑ terrā. Creſci,ram. educ tecum: et egrediemini super terram. Cresci,
2011,Portat etiā an̄ nos aliud vas argēteū plenū auro,Portat etiam ante nos aliud vas argenteum plenum auro,
2195,tiū balſami an̄ tribūal apl̓i ardētis qͣlēcūqꝫ ꝑticu,tium balsami ante tribunal apostoli ardentis qualemcumque particu,
2467,corda fideliū non vigilat ſꝫ dormit. Hanc dormicōeꝫ,corda fidelium non vigilat sed dormit. Hanc dormitionem,
225,cōcubitu surrexiſſet. percuſſit eaꝫ in,concubitu surrexisset. percussit eam in,
2081,q Hoc quid ſit. Deeſt,q Hoc quid sit. Deest,
2121,ſero. h. quicqͣꝫ. Cōmina¬,sero. h. quicquam. Commina-,
3137,dis in malū ꝓna ſūt ab adoleſcēcia ſua. Non,dis in malum prona sunt ab adolescentia sua. Non,
31,reſes exterminarūt. Et reddita eccleſijs pace: creuit vn¬,reses exterminarunt. Et reddita ecclesiis pace: crevit un-,
2418,ſolaris. ẜm auc. de crepuſculis. De hoc lec. 14.,solaris. secundum auc. de crepusculis. De hoc lec. 14.,
1541,nacho eo inuito. ſed non hereditatem. bal. in. l. ex repudiatione,nacho eo invito. sed non haereditatem. bal. in. l. ex repudiatione,
1894,det in ſenili ætate: ne vir exul tanto tēpore lugeat ſterilitatem.,det in senili aetate: ne vir exul tanto tempore lugeat sterilitatem.,
42,in prelium. Anectanabꝰ,in proelium. Anectanabus,
3300,vita viuere: qꝛ ꝓfecto ſicuti maiꝰ aliqͥd,vita vivere: quia profecto sicuti maius aliquid,
3218,orōnes et miſſe per aliquo facte quo ad expiationē,orationes et missae per aliquo factae quoad expiationem,
3531,incipit quero quare hore iſte ſunt inſtitute ⁊cͣ,incipit quaero quare horae istae sunt institutae et cetera,
3073,cate ſūt aque: et eleuauer̄t archā in ſb̓lime a,catae sunt aquae: et elevaverunt arcam in sublime a,
351,1. Corinth. 14. Cū igit̉ dicit̉: occulta cor,1. Corinth. 14. Cum igitur dicitur: occulta cor,
3258,amariſſime plorare ꝑhibet̉. Plorat,amarissime plorare perhibetur. Plorat,
3090,Ecordatꝰ auteꝫ dominꝰ nōe cunc,Recordatus autem dominus nomine cunc,
3287,mina nr̄e cecitatis. vnde ſignant̉ ait.,mina nostrae caecitatis. unde signantur ait.,
3358,per blāda parit̉ ⁊ aſpera tractus tandā ad ſemitas ve¬,per blanda paritur et aspera tractus tandam ad semitas ve-,
118,fenſorē tuū. Mane autē facto cum,fensorem tuum. Mane autem facto cum,
87,dere debet. Referunt enim homīes,dere debet. Referunt enim homines,
2222,ſtias d̓ manu apl̓i ore ſumūt. apl̓o quoꝫ porrigēte,stias de manu apostoli ore sumunt. apostolo quod porrigente,
3509,don licius cū ſuis impreſſionē achilli fecit. cedit,don lycius cum suis impressionem achilli fecit. cedit,
2953,ſic de alijs. Secunda pars eſt de cōnexione membrorum pre,sic de aliis. Secunda pars est de connexione membrorum prae,
2298,Propoſitō iiij,Propositio iiii,
2201,latī expādūt cū ſacº corꝑe cōchā ml̓to ⁊ cū tremo,latim expandunt cum sacro corpore concham multo et cum tremo,
1987,ergo epiſcopi orientales quidem vſqꝫ ad terminos egipti circa libiā,ergo episcopi orientales quidem usque ad terminos aegypti circa libyam,
3500,teret̉. ſe rei principē futurū. ſi pater velit. de eius,teretur. se rei principem futurum. si pater velit. de eius,
3172,malicia ꝯgnoſcitur. ſꝫ in drā mētis. Qd̓ ſi fue,malitia congnoscitur. sed in differentia mentis. Quod si fue,
3097,deūtes: et ceper̄t minui. pꝰ centūqͥnqͣginta di,deuntes: et coeperunt minui. post centumquinquaginta di,
2336,locus eidem aliqͥd dicēdi: ad iuſtificationem,locus eidem aliquid dicendi: ad iustificationem,
247,dem nocte apparuit philippo in ſom,dem nocte apparuit philippo in som,
1792,cluſionē dat̉ benedictio ſolito more. ¶ Deinde leget̉ euange¬,clusionem datur benedictio solito more. ¶ Deinde legetur evange-,
3001,ad vtriuſqꝫ iuris noticiaꝫ. qꝛ oīuꝫ habere,ad utriusque iuris notitiam. quia omnium habere,
1689,¶ Itē attēdēdo occaſionē pc̄ti: ſil̓r pꝫ. ꝙ hō,¶ Item attendendo occasionem peccati: similiter patet. quod homo,
1875,Claudimus infauſto: vir pluribus exulat annis,Claudimus infausto: vir pluribus exulat annis,
3644,tāduꝫ tn̄ eſt qd̓ tediū hꝰ vite ꝓueīt ex diu̓ſis cauſ. Qnqꝫ,tandum tamen est quod taedium huius vitae provenit ex diversis causis. Quandoque,
3100,vero aque ibāt et decreſcebāt vſqꝫ ad decimū,vero aquae ibant et decrescebant usque ad decimum,
2339,etiā in iudicijs ſecularibꝰ/ reis cōfeſſis locus,etiam in iudiciis saecularibus/ reis confessis locus,
3315,deſperaue̓it perit. Vt igit̉ neqꝫ iſte ī ruina ꝑ,desperaverit perit. Ut igitur neque iste in ruina per,
2052,Callidꝰ: verberibꝰ cęſum te daue ī priſtinū dedam,Callidus: verberibus caesum te dave in pristinum dedam,
3291,afficit̉ flendo gemit. Plorat gͦ ea nō,afficitur flendo gemit. Plorat ergo ea non,
1958,exiſtenti facilis michi erit et amabilis et pla,existenti facilis mihi erit et amabilis et pla,
1414,opus manuū ſuarū cū deꝰ eſſet nō amittēs,opus manuum suarum cum deus esset non amittens,
1396,ſculū ad vos qͥ eſtis ſacroſctē eccl̓ie lumīare p̄clarū. qͥ lucetis,sculum ad vos qui estis sacrosanctae ecclesiae luminare praelarum. qui lucetis,
3471,Veſtimenta alba vt nix 30 G,Vestimenta alba ut nix 30 G,
3041,ethimo. et pleniꝰ. ff. de gra. l. iuriſcōſul.,etymo. et plenius. ff. de gra. l. iurisconsul.,
264,per gladium acutū vniuerſe ſibi de¬,per gladium acutum universae sibi de-,
3461,ſternaſqꝫ laceſſitos bellis ad concordiā cōpulit. huic perſæ ob¬,sternasque lacessitos bellis ad concordiam compulit. huic persae ob-,
3342,p̄dicent de neceſſitate ꝓpter hmoi ſigna euenire. ꝑ ſigna,praedicent de necessitate propter huiusmodi signa evenire. per signa,
3626,Et beatꝰ anthoniꝰ dicit. quod vnica racio vincendi inimi,Et beatus anthonius dicit. quod unica ratio vincendi inimi,
3126,in beſtijs. et vniu̓ſis reptilibꝰ q̄ reptāt ſuꝑ ter,in bestiis. et universis reptilibus quae reptant super ter,
1790,tes ⁊ noctē ſacratiſſimā de feſto. natiuitatis dn̄i ſolēniter di¬,tes et noctem sacratissimam de festo. nativitatis domini sollemniter di-,
1882,Terra cadaueribus: conſanguineoſqꝫ ſepulchra,Terra cadaveribus: consanguineosque sepulchra,
1334,dentur ſic determinamꝰ. dicen¬,dentur sic determinamus. dicen-,
1808,Illuīatiua,Illuminativa,
2969,Uoniaꝫ,Quoniam,
1221,pellas. Nunꝗͣ autem poteſt ante eam loco poſitam conſonantis aſpi¬,pellas. Nunquam autem potest ante eam loco positam consonantis aspi-,
3155,hoīs. Quicūqꝫ effuderit humanū ſanguineꝫ.,hominis. Quicumque effuderit humanum sanguinem.,
3398,Et creauit deꝰ hoīeꝫ ad imaginē ⁊ ſi,Et creavit deus hominem ad imaginem et si,
3030,qͥs vadat qn̄ pulſat̉ nō incidit ī penā: in¬,quis vadat quando pulsatur non incidit in poenam: in-,
174,ribus incantare. ⁊ videbat qualiter,ribus incantare. et videbat qualiter,
2183,cipiūt̉: vt hic neqꝫ haud,cipiuntur: ut hic neque haud,
486,Nterea nūciatum,Interea nuntiatum,
2573,vt nec ſtrictius fiat dei mandatū: nec la,ut nec strictius fiat dei mandatum: nec la,
2076,ſignum: & in viam di¬,signum: et in viam di-,
219,magicas trāſmutari in figurā dra¬,magicas transmutari in figuram dra-,
568,filiam nomine Cleopatram. In¬,filiam nomine Cleopatram. In-,
1454,me. d. alex. in pe. ⁊ vlt. col.,me. d. alex. in pe. et ult. col.,
2918,dum ex vna parte eos ad celebrandū trahit deuo¬,dum ex una parte eos ad celebrandum trahit devo-,
3543,uid: Salomon: Eſaias: et Hieremias,vid: Salomon: Esaias: et Hieremias,
2148,voluntatem ſuam: aut,voluntatem suam: aut,
461,curru et de verbis habitis cum rege,curru et de verbis habitis cum rege,
2027,foro regi In diuerſis officijs et reliqͣ ſtru,foro regi In diversis officiis et reliqua stru,
3219,pene ſatiſfactorie per modū euiſdā recōpēſatōis ī,poenae satisfactoriae per modum eiusdam recompensationis in,
3180,quo erat ſcm̄ oleū hn̄s in manū et dicit ei mi,quo erat sanctum oleum habens in manum et dicit ei mi,
1700,multiplicata erat. Et ꝓpter hͦ dīne iuſticie,multiplicata erat. Et propter hoc divinae iustitiae,
1510,¶ Abbas an reuocet fundum datum aduocato pro patroci¬,¶ Abbas an revocet fundum datum advocato pro patroci-,
2256,circumuagari ſinant? qui quoſlibet inuadant. innocen¬,circumvagari sinant? qui quoslibet invadant. innocen-,
2549,ctis ⁊ regul̓ autēticis eaꝝ cauſas ⁊,ctis et regulus authenticis earum causas et,
141,neqꝫ preparauit exercitū. ſed intra¬,neque preparavit exercitum. sed intra-,
1363,manendū eſt. eam retuleris. vteris ea et,manendum est. eam rettuleris. uteris ea et,
2398,nō īmerito mihi deberi dico ¶ Ampliꝰ/ nōne,non immerito mihi deberi dico ¶ Amplius/ nonne,
1242,ti viro. D. Iacobo Schenck Iurecon¬,ti viro. D. Iacobo Schenck Iurecon-,
3060,ip̄a aīalia fugiāt. ſeparent̉ ⁊ diſpergant̉,ipsa animalia fugiant. separentur et dispergantur,
43,autem aſcendens palaciuꝫ vt regi¬,autem ascendens palatium ut regi-,
1432,vel pecuniam ſi nolit habere ratum contractū monaci ſui exi¬,vel pecuniam si nolit habere ratum contractum monaci sui exi-,
1641,ī iudicādo pꝫ ꝙ peccat ex certiſſima mali¬,in iudicando patet quod peccat ex certissima mali-,
162,ſuſpirans dixit. Cuſtodiaꝫ quā tibi,suspirans dixit. Custodiam quam tibi,
28,cutiones peiores hoc eſt a nomen xp̄i ꝓfitentibꝰ in chri¬,cutiones peiores hoc est a nomen christi profitentibus in chri-,
2574,tius qͣꝫ ipſe mādauerat. qͣꝫuis inde ſu¬,tius quam ipse mandaverat. quamvis inde su-,
2083,r Ita aiunt. Hęc & lo¬,r Ita aiunt. Haec et lo-,
1863,uata nō tam̄ ceſſauit illa inquietudo. Quid igitur de,vata non tamen cessavit illa inquietudo. Quid igitur de,
496,limpiam coniurationem fecit ꝯtra,lympiam coniurationem fecit contra,
1805,Et hoc de prehemio. ¶ Sequitur tabula.,Et hoc de praeoemio. ¶ Sequitur tabula.,
173,reſpiciens in ip̄am incepit totis vi¬,respiciens in ipsam incepit totis vi-,
2056,Locutus nihil circuitione vſus es.,Locutus nihil circuitione usus es.,
2127,gilius. Om̄es hodie mo,gilius. Omnes hodie mo,
1994,cipue tamen ſignum quod ei diuinitus eſt oſtenſum. Socrates,cipue tamen signum quod ei divinitus est ostensum. Socrates,
2617,¶ Nullus actus de genere moris; in ha,¶ Nullus actus de genere moris; in ha,
2264,ſecro. Uiſum enim eſt actionem et querelam hanc popu,secro. Visum enim est actionem et quaerelam hanc popu,
3613,ul̓ negligencia ſua notabile deuocōnis impedim̄tū,vel neglegentia sua notabile devotionis impedimentum,
3144,mini et replete terram. ⁊ terror ve,mini et replete terram. et terror ve,
1784,Credo adiūgunt̉: que tn̄ feriatis diebus omittuntur.,Credo adiunguntur: quae tamen feriatis diebus omittuntur.,
3443,qui laborare nō pn̄t. Ueſceris gͦ pane tuo in ſudore vultꝰ tui. ꝓut dictū eſt pr̄i,qui laborare non possunt. Vesceris ergo pane tuo in sudore vultus tui. prout dictum est principi,
2462,dei patris in aſſumpta carne mori pro nob̓ dignatuſ,dei patris in assumpta carne mori pro nobis dignatus,
470,deſtinati ad philippum re,destinati ad philippum re,
1398,ne ſapiētie: exemploqꝫ vite ſanctiſſime: ac ſarculo correctōnis,nae sapientiae: exemploque vitae sanctissimae: ac sarculo correctionis,
2963,nitione religioſorum ſiue monaſticorum. Septima pars eſt,nitione religiosorum sive monasticorum. Septima pars est,
1450,litū vocari ab eo dn̄m. bar. in. l. cū quis. §. ſeyā. de lega. iij. ī. fi.,litum vocari ab eo dominum. bar. in. l. cum quis. §. seyam. de lega. iij. in. fi.,
1961,tecū ſim ꝑticeps bonorū. Nobilis igitur,tecum sim particeps bonorum. Nobilis igitur,
1445,eē ēphitheotā. Bald. ī. d. l. n̄ id circo paulo poſt pͥn. d̓ iur. ⁊ fac.,esse emphyteotam. Bald. in. d. l. non idcirco paulo post prin. de iur. et fac.,
1439,fam. ff. de procura.,fam. ff. de procura.,
3082,hoīes et cūcta in qͥbꝰ ſpiraculū vite ē in terra.,homines et cuncta in quibus spiraculum vitae est in terra.,
1701,ꝯgruū fuit. vt nō ſtatim puniret vl̓ iudica,congruum fuit. ut non statim puniret vel iudica,
281,proinde a me ac ab hominibꝰ irre¬,proinde a me ac ab hominibus irre-,
1381,ſponēſ militātē eccl̓iaꝫ ordinauit ⁊ diſpoſuit ad īſtar eccl̓ie tri,sponens militantem ecclesiam ordinavit et disposuit ad instar ecclesiae tri,
3229,queo: caſtrimargie deplorans incita¬,queo: castrimargiae deplorans incita-,
311,gito qd̓ ſepe inter quottidianas delicias:,gito quod saepe inter cottidianas delicias:,
2646,tate reipublice. cuiꝰ eſt pars. vl̓ ex eius,tate rei publicae. cuius est pars. vel ex eius,
2973,iuris deſcendat. ff. d̓,iuris descendat. ff. de,
2924,ſideraciones aliquas breues. ⁊ non prorſus īutiles,siderationes aliquas breves. et non prorsus inutiles,
3303,re: ita maiꝰ eſt. plorans plorauit di¬,re: ita maius est. plorans ploravit di-,
2089,s Tū ſi quis magiſtꝝ.,s Tum si quis magistrum.,
2561,tis cū trinitate ꝑſonarum trinitatē,tis cum trinitate personarum trinitatem,
528,extinctus. ⁊ qualiter ipſum honori¬,exstinctus. et qualiter ipsum honori-,
1217,citum fuiſſe: auctore quoque in arte grammatica de ſyllabis compro,citum fuisse: auctore quoque in arte grammatica de syllabis compro,
1741,ueris circūſpectōeꝫ dei Et cū oraueris,veris circumspectionem dei Et cum oraveris,
2502,ſentiēs veritatē eiꝰ qd̓ canit̉ Cōſo,sentiens veritatem eius quod canitur Conso,
294,Ulciſſimo fratri Mariano,Dulcissimo fratri Mariano,
3047,minis vide inſti. de gra. §. tertio gradu.,minis vide insti. de gra. §. tertio gradu.,
2312,am ꝯtra ea dn̄e deꝰ meꝰ vel nō ꝯgaudēdo eis,am contra ea domine deus meus vel non congaudendo eis,
1909,medici celeſtis auxilio poſuiſti ſic ab illo tandē ſanitati,medici caelestis auxilio posuisti sic ab illo tandem sanitati,
