id,text,label,Comments
57,enim egyptij ſapientes q̇ etiaꝫ ſom¬,enim aegyptii sapientes qui etiam som-,
245,ca figmenta vt deciperet regē Phi¬,ca figmenta ut deciperet regem Phi-,
1844,Ogamꝰ vos ne terreamini per ſpiritū. Verba,Rogamus vos ne terreamini per spiritum. Verba,
471,gē cenſus et tributa querētes. Qui,gem census et tributa quaerentes. Qui,
1667,ꝓpter hͦ peccatū eiꝰ ē irremediabile. Scīaꝫ,propter hoc peccatum eius est irremediabile. Scientiam,
3479,igitur ⁊ ſimilia a miſſaꝝ celebracōe excuſant. Rō,igitur et similia a missarum celebratione excusant. Ratio,
1443,¶ Abbas recipiens cenſū vel canonē tanꝙͣ ab emphitheota,¶ Abbas recipiens censum vel canonem tamquam ab emphyteota,
3117,vltra ad eū. Igit̉ ſexcenteſimop̓mo anno pri,ultra ad eum. Igitur sexcentesimo primo anno pri,
2055,Ne hæc ꝗdē. DA. imo callide. ita aꝑt̓e ip̄am rē mō,Ne haec quidem. DA. immo callide. ita aperte ipsam rem modo,
1441,n̄ ē monachus n̄ videtur cōfiteri eū eē monachū ẜm Bald. ī. l.,non est monachus non videtur confiteri eum esse monachum secundum Bald. in. l.,
2623,ſtrā eternā: tantū et totiens obligamur,stram aeternam: tantum et totiens obligamur,
167,titudine animoruꝫ. an neſcis ꝙ vnꝰ,titudine animorum. an nescis quod unus,
1348,fruitur etiā in hac vita. nō tantū habet,fruitur etiam in hac vita. non tantum habet,
205,aūt māſit macedonie incognitus.,autem mansit macedoniae incognitus.,
430,tauit ip̄m in palaciū ſuū. Cunque vi¬,tavit ipsum in palatium ſuum. Cumque vi-,
409,lam herculis qualiter conturbatur,lam herculis qualiter conturbatur,
1486,¶ Abbas ī cauſa communi poteſt eſſe procurator capl̓i. In,¶ Abbas in causa communi potest esse procurator capituli. In,
447,ille equus bucifallus homines pro,ille equus bucifallus homines pro,
1446,igno. ꝗd aūt eꝯͣ. ſiꝗs ſoluit abbati tanꝙͣ ēphiteota nūꝗd ſibi,igno. quid autem e contra. siquis solvit abbati tamquam emphyteota numquid sibi,
2122,tio & ſic ꝓnunciatio: vt,tio et sic pronuntiatio: ut,
3414,Vnde ꝓph̓a psͣ. xvi Sub vmbra alaꝝ tuaꝝ ꝓtege me,Unde propheta psalm. xvi Sub umbra alarum tuarum protege me,
1250,dum viueret literatiſſimo: & inter germa,dum viveret litteratissimo: et inter germa,
1512,⁊ doc. ⁊ alex. in. l. cum quid in fi. ſi cert. pet.,et doc. et alex. in. l. cum quid in fi. si cert. pet.,
3608,pediat ſpm̄ Et ei non ſolū ad deuocioneꝫ non ſer­,pediat spiritum Et ei non solum ad devotionem non ser,
112,locū ⁊ euellit herbas. terenſque eas ⁊,locum et evellit herbas. terensque eas et,
3634,ſticia impedimentuꝫ eſt diuine viſionis. Nocet etiaꝫ triſti,stitia impedimentum est divinae visionis. Nocet etiam tristi,
215,ſi patrem pueri habebo. Et hec dicēs,si patrem pueri habebo. Et haec dicens,
289,Prephatio,Praefatio,
272,prelio draco qui antecedebat euꝫ. et,proelio draco qui antecedebat eum. et,
2936,Quaſi enim ſoliditas auctoritatum eſt certitudo capituloꝝ ⁊ li,Quasi enim soliditas auctoritatum est certitudo capitulorum et li,
2005,rome contra maxencium veniens militum prodicione peremptus ē,romae contra maxentium veniens militum proditione peremptus est,
1328,tum vti. vbi gaudemꝰ in ſpe. cum ſupra,tum uti. ubi gaudemus in spe. cum supra,
1301,inuiſibilia dei per ea que facta ſunt. in¬,invisibilia dei per ea quae facta sunt. in-,
2603,cidit. Nam veniale pctm̄/ ⁊ ſi nō perimit,cidit. Nam veniale peccatum/ et si non perimit,
3286,ter caligines verſat̉ ignorātie ⁊ diſcri,ter caligines versatur ignorantiae et discri,
1373,cramentorū ordinem breuiter ꝑtractantur.,cramentorum ordinem breviter pertractantur.,
149,tentiſſime venientes. Erant enī pͥn¬,tentissime venientes. Erant enim prin-,
2366,bus iudicijs reis obeē ꝯſueuit ad penā. Ante,bus iudiciis reis obesse consuevit ad poenam. Ante,
3169,ouiū māſuetudinē ꝯmutauit. et ferociā eoꝝ fi,ovium mansuetudinem commutavit. et ferociam eorum fi,
1691,Uxor ſil̓r ſe ipſa nō peccauit. ſꝫ ſuaſa a ẜpē¬,Uxor similter se ipsa non peccavit. sed suasa a serpen-,
1813,Admiratiua,Admirativa,
3405,Creſcite ⁊ multiplicamini ⁊ replete,Crescite et multiplicamini et replete,
3376,ad celebrādū diſpoſitꝰ expedit vt freq̄nter celebret. Gratiſſimū em̄ ſacrifici,ad celebrandum dispositus expedit ut frequenter celebret. Gratissimum enim sacrifici,
517,cum palacij vt vidit ſigna et vexilla.,cum palatii ut vidit signa et vexilla.,
1545,abbas poteſt adire monacho recuſante. ſed eo nō recuſante nō,abbas potest adire monacho recusante. sed eo non recusante non,
3352,De impedimēto diſparitatꝭ ¶ De impedimēto violētie,De impedimento disparitatis ¶ De impedimento violentiae,
2397,onis a te iuſtiſſimo/ miẜicordiſſimoqꝫ iudice:,onis a te iustissimo/ misericordissimoque iudice:,
2559,¶ Ptꝫ nā duo fuerūt circa dīnā na,¶ Patet nam duo fuerunt circa divinam na,
2925,ſuꝑ hac celebracionis materia ꝯponerē ſubiciens,super hac celebrationis materia componerem subiciens,
2640,betur actus exterior. qui non poteſt fieri,betur actus exterior. qui non potest fieri,
2555,ꝓpō,propositio,
2255,ptores et latrones tuto per terras ſuas paſſim quottidie,ptores et latrones tuto per terras suas passim cottidie,
292,pe in Omelias ſuper Ezechielē,pae in Homelias super Ezechielem,
3224,¶ Capitulo I,¶ Capitulo I,
3482,vita ſiue in morte ſemꝑ fieri debet. Eciaꝫ opus in¬,vita sive in morte semper fieri debet. Etiam opus in-,
518,victorie Alexandri cepit vociferare,victoriae Alexandri coepit vociferare,
2732,uinibus vbi pͥmo oſtendūtur tales maledicti.,uinibus ubi primo ostenduntur tales maledicti.,
1519,¶ Abbas poteſt reuocare procuratorem conſtitutum a ꝯuē,¶ Abbas potest revocare procuratorem constitutum a conven,
3397,illius poſtea formā a Claudio cōpertā: etiā ſi repudiauimus ut infra late uidebimꝰ: uis tamē nos ip̄a perſequi,illius postea formam a Claudio compertam: etiam si repudiavimus ut infra late videbimus: vis tamen nos ipsa persequi,
3593,em̄ ⁊ ſil̓ia remedia erit tutior hoīs cōſcientia,enim et similia remedia erit tutior hominis conscientia,
246,lippum ꝑ ſomniū. Factumqꝫ eſt ea¬,lippum per somnium. Factumque est ea-,
3049,filij vel filie ẜm Iſid̓. li. ix. ethimo.,filii vel filiae secundum Isidor. li. ix. etymo.,
2562,eſſentiarum. Et Sabellij qui po¬,essentiarum. Et Sabellii qui po-,
2002,maxencius. maximiani herculij filius inſtituit̉ imperator. Hinc eiꝰ,maxentius. maximiani herculii filius instituitur imperator. Hinc eius,
2106,pū ſe vltorē ꝓmitere fu¬,pum se ultorem promittere fu-,
290,Omelia I,Homelia I,
1297,qd̓ melius dicit̉ trinitas hec vnus deus,quod melius dicitur trinitas haec unus deus,
2493,dū ip̄e intellectꝰ ꝑ ſpēm rei exit in ac,dum ipse intellectus per speciem rei exit in ac,
3512,ꝑſis ſuccedit. prelioqꝫ r̓ſtitit Diuqꝫ cū ſerpedone,persis succedit. proelioque restitit Diuque cum sarpedone,
3601,quis in iſtis deficeret numꝙͣ deberet accedere. De,quis in istis deficeret numquam deberet accedere. De,
449,no ꝙ thaurinū caput qḋ maius ha,no quod thaurinum caput quod maius ha,
295,epiſcopo: Gregoriꝰ epiſco¬,episcopo: Gregorius episco-,
2521,ad ea q̄ ſunt manifeſtiſſima in na¬,ad ea quae sunt manifestissima in na-,
1752,orationem ꝓuocet. Conſortia iuuenū,orationem provocet. Consortia iuvenum,
2620,ad meritū vel demeritū. ſaltē boni tēꝑa,ad meritum vel demeritum. saltem boni tempora,
2269,nimie taciturnitatis accuſaretur Reſpondit. Ego vero,nimiae taciturnitatis accusaretur Respondit. Ego vero,
1286,vti vero eſt id qd̓ in vſum venerit. refer,uti vero est id quod in usum venerit. refer,
2369,igit̉ ꝯfident̓ corā iudice d̓o/ ſiue pr̄e miſcd̓iaꝝ,igitur confidenter coram iudice deo / sive patre misericordiarum,
1539,naſterium. de re iudi.,nasterium. de re iudi.,
2721,teꝫ continent. ⁊ quod pn̄t ibi eſſe ſeptem mortes.,tem continent. et quod possunt ibi esse septem mortes.,
2271,talia dicere valebo que non ſunt digna taciturnitate.,talia dicere valebo quae non sunt digna taciturnitate.,
2159,monitio. Vbi vis. Cice¬,monitio. Ubi vis. Cice-,
1931,āpliꝰ nō poſſe ꝑſuaſū eſſet extinctū fama vulgaret. Et h̓,amplius non posse persuasum esset extinctum fama vulgaret. Et hic,
3156,fundet̉ ſanguis illiꝰ Ad ymagineꝫ dei quippe,fundetur sanguis illius Ad imaginem dei quippe,
2409,¶ Ampliꝰ ſi aliqͥs aliꝰ ꝯtra me ſic procederet:,¶ Amplius si aliquis alius contra me sic procederet:,
1946,qm̄ iniꝙͣ erga te habet rex ſuſpicionē quaſi,quoniam iniquam erga te habet rex suspicionem quasi,
3276,tuiſſe iure credat̉. Ex qͦ ꝓfecto liquet:,tuisse iure credatur. Ex quo profecto liquet:,
1664,angelꝰ appetit eē pͥnᵐ: et ſil̓is deo ī potētia,angelus appetit esse principium: et similis deo in potentia,
242,hendensqꝫ auē marinā cepit suꝑ eā,hendensque avem marinam coepit super eam,
2333,ipſiꝰ qd̓ ꝑ Eſaiā edidit dicens. Narra ſi qͥd ha¬,ipsius quod per Esaiam edidit dicens. Narra si quid ha-,
1532,biennium. c. quanto. de offi. ordi. ⁊ Bal. in. l. i. vij. q. C. de his,biennium. c. quanto. de offi. ordi. et Bal. in. l. i. vij. q. C. de his,
8,damētū ⁊ augmentū id mihi potiſſimū,damentum et augmentum id mihi potissimum,
1923,ſis tormentoꝝ ac morciū generibꝰ ſpoliatū Parſqꝫ clemē,sis tormentorum ac mortium generibus spoliatum Parsque clemen,
1887,Cum vetuit primos iterum decerpere fructus:,Cum vetuit primos iterum decerpere fructus:,
121,qd̓ viderat recitauit. Tūc anectana,quod viderat recitavit. Tunc anectana,
2234,iuris aliquibus. qualem femine paciūt̉ ī mēſtruis et,iuris aliquibus. qualem feminae patiuntur in menstruis et,
298,chiele ꝓpheta: vt corā po¬,chiele propheta: ut coram po-,
3190,filiū ꝑuulū ⁊ ꝯtemtibilem ⁊ paſcit oues. Tu,filium parvulum et contemptibilem et pascit oves. Tu,
2497,ꝯſurgere ꝯcedat̉ ꝓpter qd̓ aīa d̓r qͦ¬,consurgere concedatur propter quod anima dicitur quo-,
2712,Tercio tangitur de vilitate huius peccati,Tertio tangitur de vilitate huius peccati,
75,na parebāt. Poſt hec apparebat ca,na parebant. Post haec apparebat ca,
1942,vno vidimꝰ qd̓ de duobꝰ ſūmis virꝭ Et mario magnoqꝫ,uno vidimus quod de duobus summis virum Et mario magnoque,
2528,tiam. tum propter noſtre cognitio¬,tiam. tum propter nostrae cognitio-,
138,ciatum fuiſſet ei ꝙ Artarxerſes rex,tiatum fuisset ei quod Artarxerses rex,
3628,p̄liabat̉ preliuꝫ iſrahel cuꝫ leticia. Et ſubdit̉. qd̓ dilata­,proeliabatur proelium israel cum laetitia. Et subditur. quod dilata,
1389,lumināt: ꝑficiūt et purgant: vt ſic medij a ſuꝑioribꝰ illumīati,luminant: perficiunt et purgant: ut sic medii a superioribus illuminati,
2632,ditum/ abſqꝫ eius ꝯſenſu libero/ ad actꝰ,ditum/ absque eius consensu libero/ ad actus,
2439,admittunt̉ catecumini. Scd̓a d̓r canō. Tertia cōio: rōibꝰ infra dicē¬,admittuntur catechumeni. Secunda dicitur canon. Tertia communio: rationibus infra dicen-,
1447,p̄iudicet ⁊ videat̉ fateri ſe ēphitheotā. vide bal. ibi ꝙ nō d̓ quo,praeiudicet et videatur fateri se emphyteotam. vide bal. ibi quod non de quo,
3550,Appellans autem ſit mater criſti: vtsͣ.,Appellans autem sit mater christi: ut supra.,
1672,ad qd̓ nulla creatura ē ordinata. homo aūt,ad quod nulla creatura est ordinata. homo autem,
3241,fundit̉. Iō ſacco accincta cilicino ſua,funditur. Ideo sacco accincta cilicino sua,
1804,erūt xv capitula d̓ doctrinis vtilibꝰ ad eleuacōꝫ m̄tis ī deū.,erunt xv capitula de doctrinis utilibus ad elevationem mentis in deum.,
2114,dā ītroduc̄ volūtas. Nō,dam introducit voluntas. Non,
2661,non pro ſemꝑ eoꝝ obligatio eſt ſub qua,non pro semper eorum obligatio est sub qua,
1606,miſſam. Sol. Regulariter ſola eccīa ꝯſecrata. ¶ Dubi. ſcd̓m. Utꝝ ne qͥs,missam. Solutio. Regulariter sola ecclesia consecrata. ¶ Dubium secundum. Utrum nequis,
1501,ctum tale eſt quidam abbas.,ctum tale est quidam abbas.,
185,macedoniā ſedenſqꝫ manam gre¬,macedoniam sedensque manam grae-,
204,memorie mandaret̉. Anectanabꝰ,memoriae mandaretur. Anectanabus,
2078,erroris ad rectam viam.,erroris ad rectam viam.,
1926,opiā redactū ceū aliqd̓ fortūe ꝓdigiū mirarent̉. Amico¬,opiam redactum ceu aliqud fortunae prodigium mirarentur. Amico-,
1932,moribꝰ hec pauꝑtas h̓ laboꝝ cumulꝰ pulſum pr̄ia ꝓcul¬,moribus haec paupertas hic laborum cumulus pulsum patria procul-,
1904,Ex utero ingredimur: ꝑ limina mortis abimus.,Ex utero ingredimur: per limina mortis abimus.,
3473,ſarie 41 E,sariae 41 E,
3570,ultera ſignum querit et non dabitur ei niſi ſignū Ione ꝓphe,ultera signum quaerit et non dabitur ei nisi signum Ionae prophe,
147,incantationes intelligebat in ipſa,incantationes intelligebat in ipsa,
3381,fuit gentilium et paganorum religio Hec egypciorum in,fuit gentilium et paganorum religio Haec aegyptiorum in,
429,corpus eiꝰ suꝑ humeros ſuos por¬,corpus eius super humeros suos por-,
3474,Veſtis nupcialis dr̄ caritas 71 P,Vestis nuptialis dicitur caritas 71 P,
3178,ad yeſſe ꝯſtitue̓ regē nō multitudīe vallatꝰ,ad iesse constituere regem non multitudine vallatus,
2550,declaratōes ſubiūgēdo ad gloriaꝫ,declarationes subiungendo ad gloriam,
3384,decimarum portione que diuino iure ſacerdotibus debē,decimarum portione quae divino iure sacerdotibus deben,
2265,larem eſſe. et vniuerſum eccleſiaſticum ſtatum continge¬,larem esse. et universum ecclesiasticum statum continge-,
1276,vtendum eſt. alie que fruunt̉ et vtunt̉.,utendum est. aliae quae fruuntur et utuntur.,
3621,tatis articulo ut in ꝑiculo mortis ſufficit habere,tatis articulo ut in periculo mortis sufficit habere,
2151,nas ſeruiles.,nas serviles.,
206,Quomodo Anectanabus aſcē,Quomodo Anectanabus ascen,
131,ſum. motum etiā firmamenti tradi,sum. motum etiam firmamenti tradi,
296,pus: ſeruus ſeruorum dei:,pus: servus servorum dei:,
454,ſuis. Conficite cancellos ferreos vt,suis. Conficite cancellos ferreos ut,
3290,infirmitatū ſuaꝝ. ⁊ maculis qͥbꝰ intꝰ,infirmitatum suarum. et maculis quibus intus,
3441,borare pōt: ſi ſe elemoſynis īmiſcet: captiuādus eſt ⁊ in ſeruituteꝫ redigendus.,borare potest: si se elemosynis immiscet: captivandus est et in servitutem redigendus.,
2291,crato ut habet̉ leuit. 7. Huic etiā atteſtat̉ cō¬,crato ut habetur levit. 7. Huic etiam attestatur con-,
1498,⁊ .i. q. ij. ſi quis. doc. in cle. attendentes. §. ſtatuimus. d̓ ſta. regu.,et .i. q. ij. si quis. doc. in cle. attendentes. §. statuimus. de sta. regu.,
1695,potuit: ſic̄ dictū ē. ¶ Itē quātū ad ꝯgruita¬,potuit: sicut dictum est. ¶ Item quatum ad congruita-,
1513,¶ Abbates non pn̄t benedicere vel conſecrare veſtes calices,¶ Abbates non possunt benedicere vel consecrare vestes calices,
1972,taciturnitati tradentes virtutes eoꝝ aut illi exſortes erunt hꝰ hiſtorie,taciturnitati tradentes virtutes eorum aut illi exsortes erunt huius historiae,
3062,al̓s oues quaſdaꝫ ad nemora fugādo vt,alias oves quasdam ad nemora fugando ut,
2568,Sicut interfectio hominis ꝑ ebriū non,Sicut interfectio hominis per ebrium non,
1312,¶ Item quid interſit inter frui et vti ali¬,¶ Item quid intersit inter frui et uti ali-,
2289,ꝑs erat ſacerdotis. tercia erat offerentiū ⁊ ea,pars erat sacerdotis. tertia erat offerentium et ea,
473,imꝑatori noſtro. Poſtqͣꝫ enī Phi,imperatori nostro. Postquam enim Phi,
3406,terraꝫ. xxvij. q. j. in prin. in. j. glo. circa,terram. xxvii. q. i. in prin. in. j. glo. circa,
1619,ꝯͣ locū illū. nō lꝫ ibi celebrari. Et faciēs ꝯͣriū in hͦ cāu īcurrit irregularitatē.,contra locum illum. non licet ibi celebrari. Et faciens contrarium in hoc casu incurrit irregularitatem.,
2262,innocentum flaminum carnifices atqꝫ tortores. Ne mi¬,innocentum flaminum carnifices atque tortores. Ne mi-,
1634,ſimplicꝭ ad ꝯpoſitū: ⁊ pūcti ad lineā in eſſen,simplicis ad compositum: et puncti ad lineam in essen,
356,ſpiritus: qui nihil futurū indicat: ſed pre,spiritus: qui nihil futurum indicat: sed prae,
202,norē Anectanabi. et ſcripſerunt ad,norem Anectanabi. et scripserunt ad,
1405,tate donauit. regemqꝫ cūctorū q̄ in t̓ra ſunt,tate donavit. regemque cunctorum quae in terra sunt,
2290,veſtebant̉ ī eadē loco ul̓ ī irl̓m tanꝙͣ cibo ꝯſe¬,vestebantur in eadem loco vel in iherusalem tamquam cibo conse-,
1780,Sequentia Credo ⁊ Ite miſſa nō dicunt̉. Suffragiū ꝟo de,Sequentia Credo et Ite missa non dicuntur. Suffragium vero de,
11,mētoꝝ tollerātia: mundū in admiratio,mentorum tollerantia: mundum in admiratio,
1861,teor habere noticiā imo et cōpaſſionem cū eiſdem. et,teor habere notitiam immo et compassionem cum eisdem. et,
166,valet in ml̓titudine populi ſed ī for¬,valet in multitudine populi sed in for-,
2174,Fal¬,Fal-,
2971,rā datuꝝ pͥus noſſe,ram daturum prius nosse,
3409,num eꝰ ſapīe miſtice innuit. Ex qͦ verbū ideſt filium,num est sapientiae mysticae innuit. Ex quo verbum id est filium,
2072,ęquum ⁊c̄. Grauiꝰ illud,aequum et cetera. Gravius illud,
175,egyptij ſternebantur impetu claſſi,aegyptii sternebantur impetu classi,
1321,cultatē volūtatis cū fine delectationis.,cultatem voluntatis cum fine delectationis.,
1660,uit: appetēdo oīpotētiā. Un̄ Iſa. 14. Aſcēdā,vit: appetendo omnipotentiam. Unde Isa. 14. Ascendam,
2580,ſit mortalis/ primo omiſit reprimere et,sit mortalis/ primo omisit reprimere et,
3105,reuertebat̉ donec ſiccarent̉ aque ſuꝑ terram.,revertebatur donec siccarentur aquae super terram.,
2492,primit̉ interior ꝯceptio mētis. Ita,primitur interior conceptio mentis. Ita,
2365,¶ Sciēdū aūt tibi ē ꝙ ꝯfeſſio reatuū in ſecl̓ari. ¶ G,¶ Sciendum autem tibi est quod confessio reatuum in saeculari. ¶ G,
3153,nu cunctaꝝ beſtiaꝝ. et d̓ manu hoīs. De ma,nu cunctarum bestiarum. et de manu hominis. De ma,
2300,ſita eſt. eſt illicita. vana. ⁊ ſuꝑſticioſa.,sita est. est illicita. vana. et superstitiosa.,
3340,naturalibꝰ hoībus vt puta ꝙ talis qui habet talia ſigna:,naturalibus hominibus ut puta quod talis qui habet talia signa:,
1764,dn̄ica die celebrari in qͦ etiā credo ſemꝑ dicet̉ ¶ Et ꝓ tunc ibi,dominica die celebrari in quo etiam credo semper dicetur ¶ Et pro tunc ibi,
2473,¶ De diuinis noībus Fo. primū.,¶ De divinis nominibus Fo. primum.,
2437,ꝑtes p̓ncipales: In p̄ꝑatōem. in eucariſtie ꝯſecratōeꝫ: ⁊ hoſtie conſe,partes principales: In praeparationem. in eucharistiae consecrationem: et hostiae conse,
3465,niſi iuſtis de cauſis: nunqͣꝫ genti cuiqͣꝫ bellum indixerit. iactan,nisi iustis de causis: numquam genti cuiquam bellum indixerit. iactan,
144,pluuiali tenenſqꝫ in manu virgam,pluviali tenensque in manu virgam,
1976,rerum. cooperatorem inuocans deum. hinc enim habebit preſens,rerum. cooperatorem invocans deum. hinc enim habebit praesens,
1867,tientibus. proteſtatione ſolenni in ſcolis theologicis,tientibus. protestatione sollemni in scholis theologicis,
522,ſania aduentum alexandri exit con¬,sania adventum alexandri exit con-,
3483,iūctū ꝑ obediēciā ſt̄a dr̄ nc̄itaˢ qꝛ ſt̄ꝫ ē me ei obedie̓,iunctum per oboedientiam sancta dicitur necessitas quia sanctum est me ei oboedire,
1374,Actoris epiſtola,Actoris epistola,
3032,ne qͥſqꝫ pōt domū exire. qꝛ ſtatuēs ſic vi,ne quisque potest domum exire. quia statuens sic vi,
2150,hoc eſt piſtrinum & pœ,hoc est pistrinum et poe,
1492,¶ Abbas poteſt pati ad tempus ꝙ monachus habeat certoſ,¶ Abbas potest pati ad tempus quod monachus habeat certos,
3326,reſurgēdi ꝓpt̓ hoc ⁊ grā ſācti ſpūs nō ſolū bn̄,resurgendi propter hoc et gratia sancti spiritus non solum bene,
1981,bat. Alexandrine autem alexander et hieroſolimorum machariꝰ,bat. Alexandrinae autem alexander et hierosolymorum macharius,
3206,ſiue viuū ſiue defunctū licitum ſibi fuit pro anime,sive vivum sive defunctum licitum sibi fuit pro animae,
3647,enī ꝓueīt ex ꝯſideratōe maloꝝ qͥbꝰ mundꝰ plenꝰ eſt. Vn̄,enim provenit ex consideratione malorum quibus mundus plenus est. Unde,
1794,um laudamꝰ. ⁊ ꝯtinuant̉ laudes vſqꝫ ad finē. ¶ Nota ꝙ vo,um laudamus. et continuantur laudes usque ad finem. ¶ Nota quod vo,
3191,autē regem requiris. O. pr̄ ꝑuulū ⁊ paſtorem,autem regem requiris. O. pater parvulum et pastorem,
2585,veniale magꝭ poſt dici cohibitum qͣꝫ ꝓhi,veniale magis post dici cohibitum quam prohi,
2420,brandū eſt: qui ex ꝑſona eccleſie rn̄deat ſacerdoti. cū ſalutādo eccleſ,brandum est: qui ex persona ecclesiae respondeat sacerdoti. cum salutando eccles,
2066,liter denūciat.,liter denuntiat.,
132,derunt etiā vniuerſo orbi per altitu,derunt etiam universo orbi per altitu,
2496,cta. vt ex ea ⁊ ītellectu qd̓dā vnum,cta. ut ex ea et intellectu quoddam unum,
168,leo multos ceruos in fugam vertit,leo multos cervos in fugam vertit,
326,acceſſus eius oſtendit̉:,accessus eius ostenditur:,
1259,plinarum cultor: ſediſqꝫ Vuormacienſis Iudex pius &,plinarum cultor: sedisque Vuormaciensis Iudex pius et,
338,ſacre ſcripture teſtimonijs oſtendamus.,sacrae scripturae testimoniis ostendamus.,
2737,ſtica ex carnali amore ꝯferūt. Et in fīe triplici rōe on̄dit̉,stica ex carnali amore conferunt. Et in fine triplici ratione ostenditur,
97,dijs concubet tecū. ⁊ te in cūctis pro,diis concubet tecum. et te in cunctis pro,
3116,alios dies. et emiſit columbā: que nō ē reu̓ſa,alios dies. et emisit columbam: quae non est reversa,
2544,ſtudui. qͣtenꝰ ī theologia nouitij ne,studui. quatenus in theologia novicii ne,
1952,iſte. Reſpōdebis ꝓ hijs q̄ heſte̓na die locu¬,iste. Respondebis pro iis quae hesterna die locu-,
436,dū ſtulticia fecit tua ita eſt. Et iuſſit,dum stultitia fecit tua ita est. Et iussit,
29,ſtianos fierēt. Sed dedit deus ſapientiā ſanctis ſuis: qui,stianos fierent. Sed dedit deus sapientiam sanctis suis: qui,
3000,gnificationibꝰ acceſſum faciliorē habeant,gnificationibus accessum faciliorem habeant,
3522,ſi obligo me ſimul duobus. A. et. B. dicēdū vter¬,si obligo me simul duobus. A. et. B. dicendum uter-,
3624,qui ſepe aūt frequenter cōmunicare ꝓponit. non,qui saepe autem frequenter communicare proponit. non,
2377,hāc legē obtinuit in ꝯſiſtorio tuo rex dauid mi,hanc legem obtinuit in consistorio tuo rex david mi,
9,martyriū videt̉. Hocqꝫ nos exꝑiētia do,martyrium videtur. Hocque nos experientia do,
3210,vſus teneat eccleſie Ideo et orōnes et collecte ī ſin,usus teneat ecclesiae Ideo et orationes et collectae in sin,
2342,em̄ poſſibile ē verā eē miſcd̓iam q̄ iuſticiā om̄i,enim possibile est veram esse misericordiam quae iustitiam omni,
10,cuit ꝙ martyres magnificentiſſima tor¬,cuit quod martyres magnificentissima tor,
2976,tutes vocabuloꝝ ignorant de facili para¬,tutes vocabulorum ignorant de facili para-,
3161,mine vr̄o poſt vos et ad oēꝫ aīaꝫ viuentē q̄ ē,mine vero post vos et ad omnem animam viventem quae est,
2180,negatiuę faciunt vnam,negativae faciunt unam,
2446,nē ordinat̉. Prīo itaqꝫ in ip̄o officio aduētꝰ xp̄i in carnem ẜm quā,nem ordinatur. Primo itaque in ipso officio adventus christi in carnem secundum quam,
1705,Sꝫ ſtatiꝫ debuit punire angelū. vn̄ dilatio,Sed statim debuit punire angelum. unde dilatio,
1853,ſtrum Fateor em̄ ꝑuitateꝫ meā ſepe mite a multis pul,strum Fateor enim parvitatem meam saepe mite a multis pul,
2569,vtentē ratione; nō habet culpam maio,utentem ratione; non habet culpam maio,
3102,apparuer̄t cacumina moncium Cumqꝫ tranſiſ,apparuerunt cacumina montium Cumque transis,
3314,iuſtꝰ ꝑ negligenciā cadit et peccator cū de ſe,iustus per neglegentiam cadit et peccator cum de se,
3098,es. Reqͥeuitqꝫ archa mēſe ſeptimo viceſimo,es. Requievitque arca mense septimo vicesimo,
1249,memorię). Officiali Moguntino homine,memoriae). Officiali Moguntino homine,
1933,dubio in aliēis terre laribꝰ bello circūtonāte ac ſemi ob¬,dubio in alienis terrae laribus bello circumtonante ac semi ob-,
2231,nō nūqͣꝫ hec īmundicia ex infirmitate aut debilitate,nonnumquam haec immunditia ex infirmitate aut debilitate,
2382,mīam tuā ꝓpoſitū ꝯfeſſiōis: vt remiſſionē īpe,misericordiam tuam propositum confessionis: ut remissionem impe,
3354,De impedimento publice honeſtatis iuſticie.,De impedimento publicae honestatis iustitiae.,
1509,tus ī regula. Io. an. in. c. pe. de eta. ⁊ quali.,tus in regula. Io. an. in. c. pe. de eta. et quali.,
2648,¶ Quoniā rationabile eſt vt nullus ho¬,¶ Quoniam rationabile est ut nullus ho-,
1302,tellecta ꝯſpiciant̉. id eſt vt de tempora,tellecta conspiciantur. id est ut de tempora,
1624,beat eē altare ſuꝑ qͦ celebrare lꝫ. Sol. Altare dꝫ eē lapideū. ꝯſecratū. n̄ enor¬,beat esse altare super quo celebrare licet. Solutio. Altare debet esse lapideum. consecratum. non enor-,
2147,cutus. Ipſam rem. id eſt,cutus. Ipsam rem. id est,
1908,Fo.,Fo.,
3011,De ¶ A,De ¶ A,
2639,ſubditi/ hoc poteſt fieri. dū videlicet iu¬,subditi/ hoc potest fieri. dum videlicet iu-,
1218,batur. Pro ſimplici quoque in media dictione inuenitur: ſed in com¬,batur. Pro simplici quoque in media dictione invenitur: sed in com-,
2731,Octauuꝫ capitulū eſt de peccato edificantiū ſyon in ſang,Octavum capitulum est de peccato aedificantium sion in sang,
3212,ſtico doctore reprobatus legūtur ẜm deuotōeꝫ pe¬,stico doctore reprobatus leguntur secundum devotionem pe-,
