id,text,label,Comments
3505,iudicaſſꝫ. ⁊ tūc ſibi venerē pollicitā eē. ſi ſuā ſpeci,iudicasset. et tunc sibi venerem pollicitam esse. si suam speci,
2393,ſo. ⁊ iuſticiā tuā ꝯtra memetip̄m exeqͦr. Iuſtꝰ,so. et iustitiam tuam contra memet ipsum exequor. Iustus,
3592,­ant ad totum ſaltem ꝑtim recompenſent ꝑ hec,ant ad totum saltem partim recompensent per haec,
3587,alio tempore recuparent quod facere non po­,alio tempore recuperarent quod facere non po-,
513,alexander victis armenijs triūphū,alexander victis armeniis triumphum,
3617,et negligenciam ſuā. vtpote ſi eſſet grauatus ca,et neglegentiam suam. utpote si esset gravatus ca,
1962,ille vir infirmi verba ſuſcipiēs fecit iuxta ꝙ,ille vir infirmi verba suscipiens fecit iuxta quod,
1247,Ogatus a pleriſqꝫ politioris literaturæ a¬,Rogatus a plerisque politioris litteraturae a-,
3255,ptū: ⁊ poſtea dn̄i ſuffragante clemen,ptum: et postea domini suffragante clemen,
381,dixit. Magiſter ītellige de me quid,dixit. Magister intellige de me quid,
2578,dam aſſerimꝰ quālibꝫ veritatē ¶ Homo,dam asserimus quamlibet veritatem ¶ Homo,
3523,que tūc poſſuꝫ ſoluere per vnā copulatim i nec ob¬,que tunc possum solvere per unam copulatim i nec ob-,
2134,damus & amicis: dedimus tantū hoſtibus: e Ea lege,damus et amicis: dedimus tantum hostibus: e Ea lege,
352,dis eius manifeſta fiūt: profecto monſtra,dis eius manifesta fiunt: profecto monstra,
258,le ariolus dixit. Philippe nō ab ho,le hariolus dixit. Philippe non ab ho,
7,ligent̓ ꝑſtrutanti chriſtiane eccleſie fun,ligenter perscrutanti christianae ecclesiae fun,
1673,erat ordinatꝰ ad ſcīaꝫ: quā appetebat. ideo,erat ordinatus ad scientiam: quam appetebat. ideo,
3538,mors et paſſio criſti fuit ꝓphetiſata. Et iterum modo quo ſu,mors et passio christi fuit prophetisata. Et iterum modo quo su,
237,ait. Noli expaueſcere. qꝛ deus Ha¬,ait. Noli expavescere. quia deus Ha-,
1765,dem offitiū dn̄icale eiuſdeꝫ dn̄ice in proximā diem feriatam,dem officium dominicale eiusdem dominicae in proximam diem feriatam,
3604,men affectus ſuus non ſit bene purgatus. ſꝫ occu,men affectus suus non sit bene purgatus. sed occu,
3138,igit̉ vltͣ ꝑcuciā oēꝫ aīaꝫ viuenteꝫ ſic̄ feci cūctiſ,igitur ultra percutiam omnem animam viventem sicut feci cunctis,
1500,obſtante iuramento contrario. Oldr. conſi. xcvij. incipiente. fa¬,obstante iuramento contrario. Oldr. consi. xcvii. incipiente. fa¬,
2543,ſeminata ſuccingere ſub compēdio,seminata succingere sub compendio,
64,aſpexit eā dixit. Magiſter quid co¬,aspexit eam dixit. Magister quid co-,
1305,fruendū eſt. que eterne et incōmutabi¬,fruendum est. quae eternae et incommutabi-,
1283,tur. nos poſſumꝰ quaſi inter vtraſqꝫ cō,tur. nos possumus quasi inter utrasque con,
3388,Nam cū apud eos teſte Quintiliano libro. xii. de inſtitutione oratoria: nullæ litteræ dulcius ſpirēt qͣꝫ. y. &. z.,Nam cum apud eos teste Quintiliano libro. xii. de institutione oratoria: nullae litterae dulcius spirent quam. y. et. z.,
2598,nis infideliū vita/ peccatū eſt; ſi et dum,nis infidelium vita/ peccatum est; si et dum,
274,rediret macedoniā obuiauit ei O¬,rediret macedoniam obviavit ei O-,
3429,zātis Exhͦ p̄ꝫ qͣꝫ dānabile ⁊ ꝑicu,zantis Ex hoc patet quam damnabile et pericu,
3074,terra. vehement̓ em̄ inundauer̄t: et oīa reple,terra. vehementer enim inundaverunt: et omnia reple,
2185,pigre neqꝫ inultus occi¬,pigre neque inultus occi-,
248,nio deus Hamon concubens cum,nio deus Hamon concubens cum,
1517,at ad epiſcopum. Inno. in. c. cum hic de eo ꝗ fur. or. ſu. ⁊ bald.,at ad episcopum. Inno. in. c. cum hic de eo qui fur. or. su. et bald.,
2583,eſſe peccati mortalis. ⁊ an̄ nunqͣꝫ fuit veꝝ,esse peccati mortalis. et ante numquam fuit verum,
2693,noſtra. ⁊ nr̄a eſſe. q̄ aliqn̄ putauimus. Deus per quē,nostra. et nostra esse. quae aliquando putavimus. Deus per quem,
3445,Et tu de ruſticoꝝ genere rudiſſimo: tugurioqꝫ viliſſimo cōpactus. nō cōmittas,Et tu de rusticorum genere rudissimo: tugurioque vilissimo compactus. non committas,
1893,go Deum oīm reꝝ conditorē propagatorēqꝫ ut ſemen fœcun¬,go Deum omnium rem conditorem propagatoremque ut semen fecun-,
529,fice ſepeliuit.,fice sepelivit.,
1318,tis. frui autē eſt vti cum gaudio nō ad¬,tis. frui autem est uti cum gaudio non ad-,
1332,¶ Determinatio eoꝝ que vident ꝯtraria.,¶ Determinatio eorum quae vident contraria.,
135,bo rege ipſorum ꝙ fuerit ingenio¬,bo rege ipsorum quod fuerit ingenio-,
3322,tatem ⁊ iuſti naufragiū fiat peccatori ſtabili,tatem et iusti naufragium fiat peccatori stabili,
2443,☞ Et qꝛ ſacrificiū illud memoriale eſt dn̄ice paſſiōis vt .1. Coꝝ. 11.,¶ Et quia sacrificium illud memoriale est dominicae passionis ut. 1. Co.rum. 11.,
2956,eſt de ammonitione hominum quātum ad ea que ſunt communia,est de admonitione hominum quantum ad ea quae sunt communia,
1491,pre. ſine conſen. ca. Bal. in mar. v̓. xiiij.,prae. sine consen. ca. Bal. in mar. ver. xiiii.,
2077,xit: quaſi exinde ius ſit,xit: quasi exinde ius sit,
2117,ſi grece ędipodis.,si graece oedipodis.,
452,igitur vidiſſet Philippus rex ipſius,igitur vidisset Philippus rex ipsius,
2498,dāmodo oīa eſſe vt habet̉ tercio de,dammodo omnia esse ut habetur tertio de,
1751,rū ſi lectio in te faſtidiū ſb̓mouerit ad,rum si lectio in te fastidium submoverit ad,
2590,et preter dilectionē dei ⁊ non contra.,et praeter dilectionem dei et non contra.,
163,condidi bene obſerua. ſed nō tamē,condidi bene observa. sed non tamen,
1992,romanorum. Huic enim viro et alia quidem plurima poſtea pro¬,romanorum. Huic enim viro et alia quidem plurima postea pro-,
1468,in. ij. col. in. vij. no. eo. ti. ⁊ aliquid in. c. cum non liceat. in. vj.,in. ii. col. in. vij. no. eo. ti. et aliquid in. c. cum non liceat. in. vi.,
170,lum ſolus. ⁊ fecit nauiculas ereas ī,lum solus. et fecit naviculas aereas in,
238,mon auxiliator tibi erit. Et his di¬,mon auxiliator tibi erit. Et his di-,
284,ra draconis apparuit philippo in cō,ra draconis apparuit philippo in con,
2272,Quocirca cum optimates maxime deceat bonis mori¬,Quocirca cum optimates maxime deceat bonis mori-,
1995,T quoniam ad hec venimus: paulo latiꝰ aliquid referamꝰ,Et quoniam ad haec venimus: paulo latius aliquid referamus,
3590,­nius ⁊ audiāt unā miſſā aut pl̓es qn̄ feſtum ē,nius et audiant unam missam aut plures quando festum est,
3472,Veſtes an reſurgentibꝰ ſint neceſ,Vestes an resurgentibus sint neces,
1453,dictum an ita indiſtincte procedat vide ibi modernos ⁊ maxi¬,dictum an ita indistincte procedat vide ibi modernos et maxi-,
1524,cōteſt. non poſt ẜm Inno. ibi.,contest. non post secundum Inno. ibi.,
3223,A iij,A iii,
3394,ter diſcrimina dentiū eodē teſte efflatur: quæ etiā cū nō uocalē proximā accæpit: quaſſa quodāmodo: utiqꝫ,ter discrimina dentium eodem teste efflatur: quae etiam cum non vocalem proximam accaepit: quassa quodammodo: utique,
2547,ſo valeāt deo gratiꝰ ⁊ ip̄is ſalubriꝰ,so valeant deo gratius et ipsis salubrius,
2999,tes. his cognitis pͥncipijs ⁊ terminorū ſi¬,tes. his cognitis principiis et terminorum si-,
2113,nera: qͣndā neceſſitas: qͣn,nera: quandam necessitas: quan,
2352,ſericordit̓ iudicare. p̄ſertim cū ip̄a ꝟitas ī euā,sericorditer iudicare. praesertim cum ipsa veritas in evan,
2363,bonitatꝭ miẜatiōe: ꝓpt̓ defendēdos īiuſte op,bonitatis miseratione: propter defendendos iniuste op,
2199,is ep̄is pr̄iarcha velut ī ſacris ſolēnitatibꝰ paſca,is episcopis patrriarcha velut in sacris sollemnitatibus pasca,
1843,ordinis cartuſiēſis. ſacre pagine profeſſore doctiſſimo,ordinis cartusiensis. sacrae paginae professore doctissimo,
2656,tentione ſiniſtra. vel abſqꝫ attētione/ ab,tentione sinistra. vel absque attentione/ ab,
2987,p̄tationē ꝑueniamꝰ: pauca de ip̄iꝰ ſignifi¬,pretationem perveniamus: pauca de ipsius signifi-,
1421,in obedienciam cecidaramꝰ illuc denuo ſua,in obedientiam cecidaramus illuc denuo sua,
2966,Sequitur diſtinctio prima Prime partis.,Sequitur distinctio prima Primae partis.,
1891,Anna diu vanos. Narracionē aggreditur incipiens a ſterili,Anna diu vanos. Narrationem aggreditur incipiens a sterili,
2129,nocte accipit̉: vt hoc ipſum. Nunqͣꝫ hodie. m. in. b Quo,nocte accipitur: ut hoc ipsum. Numquam hodie. m. in. b Quo,
1449,¶ Abbas vēdicās monachuꝫ nō obtinet licet ſolū ꝓbet ſe ſo,¶ Abbas vendicans monachum non obtinet licet solum probet se so,
2310,¶ Capitulum VII,¶ Capitulum VII,
2193,pꝰ eū maximꝰ ꝯcurſus ppl̓oꝝ fit viroꝝ ⁊ ml̓ierū,post eum maximus concursus populorum fit virorum et multierum,
3627,cuꝫ eſt leticia ſpūalis. Legit̉ etiaꝫ.j. math̓.iij. de iuda. qd̓,cum est laetitia spiritualis. Legitur etiam. i. matthe. iii. de iuda. quod,
3338,Uidet̉ mihi adhuc ꝙ hec ſcīa ſit licita. Si videns ꝑ ſig¬,Videtur mihi adhuc quod haec scientia sit licita. Si videns per sig-,
1953,tus es o rex ecce adſū ꝑatꝰ ſequi te ꝑ viam,tus es o rex ecce adsum paratus sequi te per viam,
1845,ſunt apoſtolica. ad plebē theſſalonicā miſſa. in,sunt apostolica. ad plebem thessalonicam missa. in,
1470,¶ Abbas poteſt p̄ſcribere ius ordinandi monachos nō alioſ,¶ Abbas potest praescribere ius ordinandi monachos non alios,
1848,quaſi tunc inſtaret dies iudicij proxime futura. vt pa¬,quasi tunc instaret dies iudicii proxime futura. ut pa-,
2546,de tanta re loqui ſermone in offen¬,de tanta re loqui sermone in offen-,
114,nes ꝑ diabolica figmenta. vt in ea¬,nes per diabolica figmenta. ut in ea-,
3485,opꝰ ec̄ te excuſat. qꝛ tuꝰ n̄ es ſꝫ eiꝰ cui dediſti fideꝫ,opus etiam te excusat. quia tuus non es sed eius cui dedisti fidem,
1337,ſpēm videbimꝰ quo fruemur. Hic autē,speciem videbimur quo fruemur. Hic autem,
3610,ne iij. Recenti adhuc reſperſus puluere ora ſacra,ne iii. Recenti adhuc respersus pulvere ora sacra,
2482,moriale tu¬,moriale tu-,
468,Oſt hec uene,Post haec vene,
3568,tribns diebus et tribus noctibꝰ in ventre ceti fui. Et hec ipſe,tribus diebus et tribus noctibus in ventre ceti fui. Et haec ipse,
111,cōtinuo castra ciuitatis in deſertuꝫ,continuo castra ciuitatis in desertum,
3043,¶ Abauūculꝰ eſt frater abauie ẜm Iſid̓.,¶ Abavunculus est frater abaviae secundum Isidor.,
2436,tur ⁊ a pr̄e filiꝰ. ⁊ filiꝰ ad pr̄em. Et diuidit̉ totū illd̓ officiū in tres,tur et a patre filius. et filius ad patrem. Et dividitur totum illud officium in tres,
399,Anectanabus reſpondit. Eſt ſatis.,Anectanabus respondit. Est satis.,
3275,p̄ſentiarū nihil durius cōtingere po¬,praesentiarum nihil durius contingere po-,
3177,tis poſſidebat aīmū. Venit ergo ſcūs ſamuel,tis possidebat animum. Venit ergo sciens samuel,
3298,ſctāꝝ idioma recte xp̄i eccl̓ia plorās,sanctarum idioma recte christi ecclesia plorans,
2714,ponunt̉ octo mala que habundant in mercatoribus ⁊ vbi,ponuntur octo mala quae abundant in mercatoribus et ubi,
491,iugo ſuo ſubijceret. Erat aūt q̇dam,iugo suo subiceret. Erat autem quidam,
2248,hac paſſiōe uexabat̉. Quidā uix ſōpniāt dormiē¬,hac passione vexabatur. Quidam vix somniant dormien-,
2722,In fine tangit̉ de diuerſis ſpeciebꝰ muneꝝ.,In fine tangitur de diversis speciebus munerum.,
2144,Quartū parelcon: quia,Quartum parelcon: quia,
188,quia Anectanabꝰ non inueniebat̉,quia Anectanabus non inveniebatur,
1285,amore alicui rei inherere ꝓpter ſeipſam.,amore alicui rei inhaerere propter se ipsam.,
379,A 2,A 2,
3421,pientia dei ſapīa v̓o eſt ſplendor eterne lu¬,pientia dei sapientia vero est splendor aeternae lu-,
1238,in quibus. i. āte. u. ꝯſonātē poſita ꝓducitur: eadēqꝫ ſubtracta corripit̉,in quibus. i. ante. u. consonantem posita producitur: eademque subtracta corripitur,
3436,uare de fonte. ẜm Tho. Rō qͥa,vare de fonte. secundum Tho. Roma quia,
422,it ꝙ tali debeaꝫ ſupplicio mori. Nō¬,it quod tali debeam supplicio mori. Non-,
373,B Nonne cor meū in preſenti,B Nonne cor meum in praesenti,
2200,libꝰ p̄ꝑat ſe et pꝰ cū ȳnis ⁊ ſpūalibꝰ laudibꝰ pau,libus praeparat se et post cum hymnis et spiritualibus laudibus pau,
2989,co quorūdam terminorū qͥ in iure vtroqꝫ,co quorundam terminorum qui in iure utroque,
1703,na multiplicaret̉. et maxime numerꝰ elc̄oꝝ,na multiplicaretur. et maxime numerus electorum,
3399,militudinē ſuā. d̓ pe. di. ij. c. prīceps. ī,militudinem suam. de pe. di. ii. c. princeps. in,
3059,artē exercēs vt ꝑ aliqd̓ ſignū quod facit,artem exercens ut per aliquod signum quod facit,
2942,lud Iob. xxxviij. Quis dedit gallo intelligentiā. ideo ẜm diſtin¬,lud Iob. xxxviii. Quis dedit gallo intellegentiam. ideo secundum distin-,
1881,Quod ſupereſt expectat hians: iā plena meoꝝ,Quod superest expectat hians: iam plena meorum,
3469,Veritatem vite relinquētes 56 C,Veritatem vitae relinquentes 56 C,
1822,Exultatiua.,Exsultativa,
187,uinabat. Egyptij vero vt viderunt,vinabat. Aegyptii vero ut viderunt,
1369,¶ Incipit feliciter doctiſſimi,¶ Incipit feliciter doctissimi,
3335,ad ſurgendum. nec dicis apud temetipſum,ad surgendum. nec dicis apud temet ipsum,
319,prophetā feliciter incipit.,prophetam feliciter incipit.,
477,eſt priuatus. Audientes hec nuncij,est privatus. Audientes haec nuntii,
1530,ſicut dn̄s ſeruo. bal. in. l. i. vij. q. C. de his que pe. no.,sicut dominus servo. bal. in. l. i. vii. q. C. de his quae pe. no.,
1626,¶ Sol. Duabꝰ pallis ⁊ corꝑali ꝯſecratꝭ de lino puro factis. nullo colore tin¬,¶ Solutio Duabus pallis et corporali consecratis de lino puro factis. nullo colore tin-,
3452,illud in mare ꝓijcite. qͥbꝰ ꝓijciētibꝰ ingēs ignis in,illud in mare proicite. quibus proicientibus ingens ignis in,
1878,Currimus in fatum: tacitiſqꝫ recedimus annis:,Currimus in fatum: tacitisque recedimus annis:,
224,oſcula cognouit eā. Cum autem a,oscula cognovit eam. Cum autem a,
1681,cādo. Intellectꝰ .n. hoīſ carne obūbratꝰ erat.,cando. Intellectus enim hominis carne obumbratus erat.,
2650,cognoſcere iudicialiter ẜm modū ſuum,cognoscere iudicialiter secundum modum suum,
3427,Sap̄. An̄ omēs colles generat me. Nō vt,Sapientiae. Ante omnes colles generat me. Non ut,
3072,diluuiū qͣdraginta diebꝰ ſuꝑ terrā. ⁊ ml̓tipli¬,diluvium quadraginta diebus super terram. et multipli-,
3187,filioꝝ. et qͥ querebatur. non īueniebatur ī nu¬,filiorum. et qui quaerebatur. non inveniebatur in nu-,
102,Neqꝫ iuuenis neqꝫ ſenex et barbam,Neque iuvenis neque senex et barbam,
1387,ꝑ mōtes p̄latoſ ſuꝑiores apl̓is ſuccedētes īſinuat. qͥ ad modū,per montes praelatos superiores apostolis succedentes insinuat. qui ad modum,
3095,tes adyſſi et catharacte celi: ⁊ ꝓhibite ſūt plu,tes abyssi et cataractae caeli: et prohibitae sunt plu,
1408,dyaboli deceptꝰ. et voluptate heu ꝓchdolor,diaboli deceptus. et voluptate heu prohdolor,
1226,quod apud æoles habuit olim. f. digāma in au ab ipſius uoce ꝓfectū,quod apud aeoles habuit olim. f. digamma in au ab ipsius voce profectum,
2157,vſor es.,usor es.,
1760,bara ⁊ Lucia Credo omittit̉ ⁊ dicetur prefatio quotidiana.,bara et Lucia Credo omittitur et dicetur praefatio cottidiana.,
361,futuro ſubtrahūt tempora: ita ab oculis,futuro subtrahunt tempora: ita ab oculis,
1293,omnibus fruentibꝰ ea. ſi tamen res dici,omnibus fruentibus ea. si tamen res dici,
3115,ſuꝑ terrā. Expectauitqꝫ nichilominꝰ ſeptem,super terram. Expectavitque nihilominus septem,
2934,Prima,Prima,
2087,autonti. Ita credo monē,autonti. Ita credo monen,
3323,or portꝰ. Qn̄ eī iuſtū legero peccaſſe ⁊ peni,or portus. Quando enim iustum legero peccasse et paeni,
2338,ctanda eſt/ vt id iura teſtant̉ ¶ Rn̄deo in hͦ ꝙ,ctanda est/ ut id iura testantur ¶ Respondeo in hoc quod,
2998,modicū ꝑfecti per ignota minime ꝓcedē,modicum perfecti per ignota minime proceden,
2658,deum; de negligentia; aut ꝑuerſa inten¬,deum; de neglegentia; aut perversa inten-,
1430,nū efficis ſꝫ et om̄s qͥ tuis p̄ceptis obaudiūt,num efficis sed et omnes qui tuis praeceptis obaudiunt,
1885,Condicio. primo Deus indulſiſſe Parenti,Condicio. primo Deus indulsisse Parenti,
1761,¶ Quando aūt aliqua p̄dictaꝝ feſtiuitatū fuerit patrocini¬,¶ Quando autem aliqua praedictarum festivitatum fuerit patrocini-,
2103,milē: poteſt etiā inhuma,milem: potest etiam inhuma,
1536,quero nūquid iſte. §. C. de bo. que li.,quaero numquid iste. §. C. de bo. quae li.,
3167,bene viuēdo acqͥſierāt flāmas ī rorē ꝯu̓eter̄t,bene vivendo acquisierant flammas in rorem converterunt,
376,Sciendū quoqꝫ eſt: quia ꝓphecie tem¬,Sciendum quoque est: quia prophectiae tem-,
2164,quaſi,quasi,
67,plurima reſponſa deoꝝ. Etenim re,plurima responsa deorum. Etenim re,
427,hec dicens expirauit. Alexander au,haec dicens expiravit. Alexander au,
1871,mo propt̓ turbationem hominū fideliū ſummouendā,mo propter turbationem hominum fidelium summovendam,
3387,ſciuia dilapidarint atqꝫ diſſiparint: eccleſiarum prouen¬,scivia dilapidarint atque dissiparint: ecclesiarum proven-,
3499,der cohortabat̉ vt claſſis p̄paret̉. ⁊ in greciā mit,der cohortabatur ut classis praeparetur. et in graeciam mit,
273,inimicos eiꝰ proſternebat. Cunqꝫ,inimicos eius prosternebat. Cumque,
1616,Nullo mō dꝫ ꝓpter ꝑiculū effuſiōis ſāguīs xp̄i. ¶ Quintū dubi. Utꝝ ī om̄i,Nullo modo debet propter periculum effusionis sanguinis christi. ¶ Quintum dubium. Utrum in omni,
396,Sequere me hora noctis et oſten¬,Sequere me hora noctis et osten-,
143,dens concham eream plenā aqua,dens concham aeream plenam aqua,
1356,cimus nos ea re frui quā diligimꝰ ꝓpter,cimus nos ea re frui quam diligimus propter,
1260,iuſtus: Renato impreſſori Argētinorum pridem dede,iustus: Renato impressori Argentinorum pridem dede,
3356,tudīs cū ſtatu proprie ſalutis oberrare vellet: dīna mi,tudinis cum statu propriae salutis oberrare vellet: divina mi,
3285,gloriā ſuꝑne cōtēplatōis. tn̄ adhuc in,gloriam supernae contemplationis. tamen adhuc in,
2631,obligare quēcunqꝫ hominē/ etiā ſibi ſub,obligare quemcumque hominem/ etiam sibi sub,
3456,dijs liberaſti. Per idē tp̄s cū quedā gēs romano,diis liberasti. Per idem tempus cum quaedam gens romano,
3536,¶ Scd̓a ꝑticula primi principalis.,¶ Secunda particula primi principalis.,
2665,riori / non plus de ſe obligat ad hanc ſpe,riori / non plus de se obligat ad hanc spe,
2380,fitebor aduerſuꝫ me īiuſticiā meā dn̄o. ⁊ tu re,fitebor adversum me iniustitiam meam domino. et tu re,
1289,citus. abuſus vel abuſio nominari debꝫ.,citus. abusus vel abusio nominari debet.,
1870,libus ſpeculari. ſi tam̄ veritas in his valeat dinoſci. pri,libus speculari. si tamen veritas in his valeat dinosci. pri,
3514,de prelio redit. Itaqꝫ per aliquot dies preliatur,de proelio rediit. Itaque per aliquot dies proeliatur,
2009,ieſu chriſti et vas vnū aureū plenū t̓ra vt ꝯgnoſca,iesu christi et vas unum aureum plenum terra ut congnosca,
2683,amittit niſi deceptꝰ. q̄ꝫ nemo querit niſi āmonitꝰ. q̄ꝫ,amittit nisi deceptus. quem nemo quaerit nisi ammonitus. quem,
3363,ſapientie inuitācia Quibꝫ valde delectatus: ceteris oībꝫ,sapientiae invitantia Quibus valde delectatus: ceteris omnibus,
385,Sed triſtis ſum quia figura tua in,Sed tristis sum quia figura tua in,
2431,ti ꝯficiēdi: ꝯſecrātꝭ miniſtri: ⁊ circūſtātiaꝝ tꝑis ⁊ loci: ꝓ¬,ti conficiendi: consecrantis ministri: et circumstantiam temporis et loci: pro-,
1661,in celū ⁊cͣ. In deo enī ſūt duo .s. oīpotētia ⁊,in caelum et cetera. In deo enim sunt duo scilicet omnipotentia et,
328,ſcat̉. Prophetie temꝑa tria ſunt: ſcilicet:,scatur. Prophetiae tempora tria sunt: scilicet:,
3079,operuerat. Conſumptaqꝫ ē oīs caro que mo¬,opperuerat. Consumptaque est omnis caro quae mo-,
2608,viā enim dei nō ꝓgredi/ regredi eſt. Fac,viam enim dei non progredi/ regredi est. Fac,
2961,⁊ graduum. Quinta pars eſt de ammonitione ſcolaſticorum,et graduum. Quinta pars est de admonitione scholasticorum,
2504,dulce refrigerium. Sic ⁊ alibi Gu¬,dulce refrigerium. Sic et alibi Gu-,
3359,ritatis per amorē ſapientie mirabilit̉ reducitur. Cū eī,ritatis per amorem sapientiae mirabiliter reducitur. Cum enim,
3537,☞ Scd̓o ꝑuenit̉ et deuoluit̉ judiciū ad legē ſcripture in qua,¶ Secundo pervenitur et devolvitur iudicium ad legem scripturae in qua,
1391,res .ſ. ⁊ laicos ſil̓i mō illuminēt: ꝑficiāt et purgēt. qd̓ facere ne,res scilicet et laicos simili modo illuminent: perficiant et purgent. quod facere ne,
1216,cali eſt accipiendum: quod Cæſari doctiſſimo artis grammaticæ pla,cali est accipiendum: quod Caesari doctissimo artis grammaticae pla,
2974,iuſti. ⁊ iure. l. j. ī pͥn.,iusti. et iure. l. i. in prin.,
1271,ra: ꝙ a manu ſemꝑ cōſilium ſumpſerit: ſummāqꝫ ſapi¬,ra: quod a manu semper consilium sumpserit: summamque sapi-,
2577,Non tn̄ omībꝰ/ ꝓ om̄i tꝑe ⁊ loco p̄dican,Non tamen ominbus/ pro omni tempore et loco praedican,
2614,diſponit homo ad oꝑa virtutū. ⁊ ad faci,disponit homo ad opera virtutum. et ad faci,
1767,ceptiōis beate Marie in diem dn̄icaꝫ euenerit tunc ꝓpt̓ offi¬,ceptionis beatae Mariae in diem dominicam evenerit tunc propter offi-,
1355,idem ait in li. de doctrina xp̄iana. Di¬,idem ait in li. de doctrina christiana. Di-,
2630,eius cōmiſſione/ poteſt directe ⁊ per ſe/,eius commissione/ potest directe et per se/,
3518,tes reddit minores: ī quēlibet per mod̓ ſolucōis de¬,tes reddit minores: in quemlibet per modum solutionis de-,
1523,ra. hab. ⁊ bal. in mar. ver. procurator. in fi. quod verum an̄ lit.,ra. hab. et bal. in mar. ver. procurator. in fi. quod verum ante lit.,
2282,concinnati. vnde caperent exempla. que poſſent imitari et,concinnati. unde caperent exempla. quae possent imitari et,
516,Olimpia autē exiens incognitū lo¬,Olympia autem exiens incognitum lo-,
1338,dum in ſpe ambulamꝰ fruimur quidem,dum in spe ambulamus fruimur quidem,
1325,tende qꝛ videt̉ augͥ. dicere illos frui tan,tende quia videtur augi. dicere illos frui tan,
3519,biti cū ſit finitū Obligatus igitur ad miſſam ſpeci,biti cum sit finitum Obligatus igitur ad missam speci,
1815,Comperatiua,Comparativa,
1349,gaudiū ſpei. ſed etiā rei qꝛ iam delectat̉,gaudium spei. sed etiam rei quia iam delectatur,
2602,¶ Qui minima negligit/ paulatim de¬,¶ Qui minima negligit/ paulatim de-,
480,Darium regem perſarum.,Darium regem persarum.,
2018,gimꝰ nos adinuicē. nl̓lm viciū apud nos regͣt Sin,gimus nos adinvicem. nullum vicium apud nos regnat Sin,
3599,di deo Et an faciat ad hec diligenciam ſuam pro,di deo Et an faciat ad haec diligentiam suam pro,
416,corruere fecit vſqꝫ ad infimam par,corruere fecit usque ad infimam par,
239,ctis exijt de palacio extra ciuitatē in,ctis exiit de palatio extra civitatem in,
2463,eſt Cꝰ mors recte dulcis ſomnus ē predc̄s. ip̄o dicēte,est Cuius mors recte dulcis somnus est praedictus. ipso dicente,
282,prehenſibilis eſſe videris.,prehensibilis esse videris.,
1208,maiius peiius eiius ſcribere: quod non aliter pronunciari poſſet quā,maiius peiius eiius ſcribere: quod non aliter pronunciari posset quam,
71,⁊ eburneā mixtam auro ⁊ argento.,et eburneam mixtam auro et argento.,
1222,ratio inueniri: ſicut nec ante. u. conſonantem: unde hyulcus triſylla¬,ratio inveniri: sicut nec ante. u. consonantem: unde hiulcus trisylla-,
3645,ꝓuenit ex dei amore ⁊ deſiderio celeſtis pr̄ie. Vnde g̓gꝰ.,provenit ex dei amore et desiderio caelestis patriae. Unde gregorius.,
3418,Origenes vero ſu,Origenes vero su,
316,Explicit prefatio.,Explicit praefatio.,
3245,pubertatis ſue: vti dilectiōis oꝑa ꝑfi¬,pubertatis suae: uti dilectionis opera perfi-,
2043,In viā. DA. miror hoc ꝗd ſit. SI. ſi quęris dicam.,In viam. DA. miror hoc quid sit. SI. si quaeris dicam.,
95,aperias mihi veritateꝫ. Cui anecta¬,aperias mihi veritatem. Cui anecta-,
1426,offendis. Totus vero delicijs corꝑis dedi¬,offendis. Totus vero deliciis corporis dedi-,
1482,ſecundum Hoſt. ⁊ Io. an. ibi quando vellet celebrare officiuꝫ,secundum Host. et Io. an. ibi quando vellet celebrare officium,
2356,Gregꝰ. illud lucidiꝰ affirmat dicēs. ꝙ zeli ſcī di,Gregorius illud lucidius affirmat dicens. quod zeli sancti di,
2319,ſcondāt inqͣꝫ ab aſpectu lucidiſſimo oculoruꝫ,scondant inquam ab aspectu lucidissimo oculorum,
3238,pubertatis ſue anima qͣſi ꝟgo plan¬,pubertatis suae anima quasi virgo plan-,
1945,ſemetip̄o ait. Notū tibi ſit glorioſiſſime,semet ipso ait. Notum tibi sit gloriosissime,
2919,cio. ex altera timor offenſe r̓primit Tandeꝫ effectꝰ,tio. ex altera timor offensae reprimit Tandem effectus,
2156,k Vſus es. Legitur &,k Usus es. Legitur et,
2426,calice nō idoneo: irregularitatē incideret. De qͦ lec. 14. ꝓpe finem. Et,calice non idoneo: irregularitatem incideret. De quo lec. 14. prope finem. Et,
3311,mus erit. Iuſto quid̓ ne ꝑ negligēciam ac de,mus erit. Iusto quidem ne per negligentiam ac de,
3490,Vidi zelantem ꝑuulū nōdum loquebat̉,Vidi zelantem parvulum nondum loquebatur,
3428,aliqͥd addi plus ex merito bapti,aliquid addi plus ex merito bapti,
1281,beatos faciunt peruenire/ eiſqꝫ inherere,beatos faciunt pervenire/ eisque inhaerere,
2343,mode euacuat. Nec verā iuſticiā: q̄ miſcd̓iam,mode evacuat. Nec veram iustitiam: quae misericordiam,
2579,qui tenet̉ reprimere illecebram anteqͣꝫ,qui tenetur reprimere illecebram antequam,
